"","X.2","X.1","X","url","date","title","author","description","keywords","body","error"
"1",1,2,2,"https://taz.de/Klage-gegen-Audi/!5871147/","2022-07-29T11:02:00+01:00","Klage gegen Audi: Der Unterstrich bleibt","Linda Gerner","Beschäftigte bei Audi sollen in schriftlicher Kommunikation gendern. Ein VW-Mitarbeiter wollte das nicht akzeptieren und klagte dagegen – ohne Erfolg.","Gendern, Gendergerechte Sprache, Gleichstellung, Audi, Arbeit, Öko, taz, tageszeitung ","BERLIN taz | Kein Erfolg für den Gender-Gegner Alexander B.. Das Landgericht in Ingolstadt hat die Klage des VW-Mitarbeiters gegen eine Ansprache in geschlechtergerechter Sprache abgewiesen. Er sah seine Persönlichkeitsrechte darin verletzt, dass Kol­le­g*in­nen des VW-Tochterunternehmens Audi mit ihm in schriftlicher Kommunikation gegenderte Sprache verwendeten. Die Audi-Beschäftigten folgen damit dem Leitfaden des Unternehmens, der vorsieht, mit Unterstrich zu gendern. Diese Vorgabe gibt es seit März 2021. Audi will damit nach eigenen Angaben ein Zeichen für Gleichberechtigung setzen und die Vielfalt der Geschlechter besser abbilden. Das Gericht schmetterte die Forderung von Alexander B. nach Unterlassung nun ab, befand am Freitag aber auch, dass der Kläger als VW-Mitarbeiter selbst nicht zum Gendern verpflichtet sei. Der Leitpfaden richte sich explizit nur an Audi-Mitarbeitende. Der Kläger habe aber kein Recht darauf, „in Ruhe gelassen zu werden“, so der Vorsitzende Richter Christoph Hellerbrand. Alexander B. hatte neben der Unterlassung von gegenderten Mails an ihn eine Zahlung von 100.000 Euro bei Verstößen dagegen gefordert. Eine mündliche Verhandlung dazu war im Juni gescheitert. Der Kläger sagte vor Gericht, dass er „weitere Schritte“ nicht ausschließe, um sein Recht durchzusetzen. Er könnte gegen das Urteil in Berufung gehen, dann würde der Fall vor dem Oberlandesgericht München landen. In der Öffentlichkeit hatte der Prozess einige Diskussionen über verpflichtendes Gendern losgelöst. Gen­der­geg­ne­r*in­nen schlugen sich auf die Seite des Klägers und wetterten im Netz. Viele andere sahen die Debatte gelassener, die taz beschreibt den Kläger als „beleidigtes Leberwürstchen“. Vor Gericht hatte der Kläger betont, dass er nicht gegen das Gendern sei, wenn die Regeln der Grammatik nicht verletzt würden. Bundesweites Interesse gab es an dem Fall auch, weil es das erste Urteil zu einer möglichen Unterlassung von Gendersprache war. Andere Verfahren vor Gericht beschäftigten sich mit dem Thema Gendern sonst, weil sich Menschen durch Formulierungen im generischen Maskulinum nicht abgebildet fühlten. Große Aufmerksamkeit erhielt zum Beispiel die Klage der nun 85-jährigen Marlies Krämer, die 2018 vor dem Bundesgerichtshof erwirken wollte, dass sie von der Sparkasse nicht als „Kunde“ angesprochen wird. Der Bundesgerichtshofs (BGH) wies ihre Verfassungsbeschwerde 2020 ab, da sie nicht ausreichend begründet war.",NA
"2",2,312,312,"https://taz.de/Sprache-in-der-Schule/!5864066/","2022-07-12T11:55:00+01:00","Sprache in der Schule: Gendergap im Klassenzimmer","Matthias Kreienbrink","In der sechsten Klasse einer Berliner Schule steht Debattieren auf dem Lehrplan. Das Thema dieses Mal: Gendern.","Gendern, Geschlechter, Gendergerechte Sprache, Gender und Sexualitäten, Bildung, Gesellschaft, Schwerpunkt, taz, tageszeitung ","Schon im leeren Klassenzimmer lässt sich ausmachen, wo die Jungs und wo die Mädchen sitzen. Auf den Tischen liegen Federmappen, auf dem Boden die Ranzen. Pink, rosa und lila die einen. Dunkelblau und schwarz die anderen. Hier prangen Meerjungfrauen und Herzchen – dort Rücksäcke in Tarnmuster. Die Glocke läutet, langsam strömen die Schülerinnen und Schüler hinein. In den nächsten 80 Minuten steht Debattieren auf dem Lehrplan. Das Thema: Gendern. In etlichen Artikeln und Talkshows, in sozialen Netzwerken und Eckkneipen – die Gesellschaft diskutiert seit Jahren leidenschaftlich über das Sternchen. Es geht darum, ob und wie Sprache die Geschlechtervielfalt darstellen kann. Doch wo es um Sprachgebrauch und tradierte Denkmuster geht, scheint ein sachlicher Diskurs oft nicht möglich. Unser Verhältnis zu Worten ist ein emotionales. Aber wie ist das bei Kindern, deren Wortschatz noch keinen sentimentalen Ballast hat? „Ich blicke in viele erschöpfte Gesichter. Vom warmen Wetter und vom Sportunterricht“, sagt die Lehrerin, Anfang 40, die nicht mit Klarnamen genannt werden möchte. Über einen engeren Kontakt zur Schule ist diese Reportage möglich geworden. Die Aufgeladenheit, die das Thema in der Gesellschaft hat, besorgt sie. Darum hat sie es gewählt: Die Debatte durch die Augen von Kindern betrachten. Es ist Mai, die fünfte und sechste Unterrichtsstunde an einer Grundschule in Berlin-Mitte. Eine sogenannte „Brennpunktschule“. 64,2 Prozent der Menschen in der Gegend haben eine Migrationsgeschichte. Der Klassenraum der sechsten Klasse ist girlandenbehangen. An der Decke hängt ein Seil mit bunten Blättern, auf denen Namen und Geburtstage der Kinder stehen. Die sind zwischen 11 und 14 Jahre alt – je nachdem, ob sie schon Klassen wiederholen mussten. Es sind 19 Schülerinnen und Schüler im Raum. Das Wort „Gendern“ erscheint auf dem Whiteboard. Die Lehrerin: „Wer hat das schon mal gehört?“ Etwa die Hälfte der Kinder meldet sich. Hadice*: „Ist das etwas mit Geschlecht? Ein Mann, der eine Frau sein will?“ Taner: „Wenn sich jemand im falschen Körper fühlt, dann ist der divers.“ Immer wieder hält die Lehrerin die Kinder dazu an, sich zu melden, nicht in die Klasse zu brüllen. Doch die sechs Buchstaben am Whiteboard sorgen für Aufregung – ein Verlangen danach, diesem Begriff auf die Spur zu kommen. Die ersten Wortmeldungen handeln von trans Menschen, von diversen Personen. Begrifflichkeiten, die oftmals noch erklärende Zusätze brauchen. Die Kinder tun das vorbehaltlos: Da sind Menschen, die fühlen sich unwohl mit ihrem Geschlecht. Waren vielleicht mal ein Mann, aber jetzt nicht mehr. Für die Kinder ist das Alltag: Sie wachsen mit Tiktok und Youtube auf. Sie sehen und hören Menschen, die anders sind als sie. Ein kurzes Reel kann genügen, um dem Begriff „Gendern“ eine erste Kontur zu geben. Lehrerin: „Wer wird angesprochen, wenn ich sage: ‚Die Schüler schlagen jetzt das Buch auf?‘“ Hadice: „Schüler bedeutet jeder.“ Lehrerin: „Aber ist es gerecht, wenn ich nur Schüler sage und nicht Schülerinnen?“ Darauf hat niemand eine Antwort. Stattdessen wird nach Lösungen gesucht. Man könnte doch andere Wörter nutzen: „Alle Kinder schlagen jetzt das Buch auf.“ Oder „alle Menschen“ oder „die Klasse“. Es entsteht aufgeregtes Gequassel, die Schü­le­r:in­nen haben Freude daran, Sprache zu erkunden. Oft heißt es, Gendern sei unästhetisch, mache Sprache kaputt. Die Kinder hier suchen noch nach ihrer eigenen. Sie tasten und finden nicht immer, sprechen zu Hause oft eine andere Sprache als in der Schule. Mehrere Studien haben gezeigt, dass Gendern Einfluss auf Kinder und Erwachsene hat. Beispielsweise kann das Gendern von Berufsbezeichnungen dazu führen, dass Mädchen sich eher vorstellen können, später mal in einem „typischen Männerberuf“ zu arbeiten. Gleichzeitig ergab eine Studie des Rheingold Instituts aus diesem Jahr, dass mehr als die Hälfte der befragten 14- bis 35-Jährigen die Genderdebatte eher ablehnen. 44 Prozent halten sie jedoch für notwendig. Vor allem junge Frauen sehen darin ein wichtiges Signal. Taner und Hadice beteiligen sich besonders rege am Unterricht. Sie melden sich, warten, bis sie aufgerufen werden. Beide sind zwölf Jahre alt. Sie trägt ein rosa T-Shirt, er einen schwarzen Kapuzenpullover, darauf „Skate“ in roten Lettern. Als es wieder zu laut im Klassenraum wird, ertönt die Klangschale. Abmachung ist: Die Kinder müssen so still werden, dass der leise Gong im ganzen Raum zu hören ist. Es funktioniert. Dann bringt Taner etwas Neues ins Gespräch: „Man kann auch Schüler/innen sagen.“ Der Sechstklässler macht eine Pause zwischen den Wortbestandteilen, einen sogenannten „Gendergap“. Er habe das schon öfter in Videos gehört, sagt er. Und in den Briefen vom Amt würde das so stehen. Taner macht eine Handbewegung, um den Schrägstrich darzustellen, den er noch nicht in einem Wort ausdrücken kann. Nicht alle Kinder kennen diese Sprechweise. Nicht alle verstehen sie. Eine Diskussion entsteht: Wäre „Schüle/rinnen“ nicht einfacher auszusprechen als „Schüler/innen“? Im zweiten Teil des Unterrichts sind die Klischees an der Reihe. Die Kinder werden in vier Gruppen eingeteilt, Jungs und Mädchen getrennt. Sie bekommen Plakate und Stifte. Die Jungs sollen aufschreiben, was Mädchen vermeintlich nicht können und andersrum. „Keine Schimpfworte und keine Namen von jemandem aus der Klasse nennen“, mahnt die Lehrerin. Schließlich werden zwei Mädchen und zwei Jungs entsandt, um vorne an der Tafel die Ergebnisse ihrer Gruppen vorzustellen. Die restliche Klasse soll Argumente finden, um die Behauptungen zu entkräften. „Nicht aufregen, keine Beleidigungen schreien, das Argumentieren üben!“ Die Jungen legen los: Es geht ums Autofahren, logisch denken und handeln. Und um Döner. Mario: „Mädchen arbeiten nicht im Dönerladen.“ Ayla: „Nur weil ihr das noch nicht gesehen habt, heißt es nicht, dass keine Frauen im Dönerladen arbeiten können.“ Mario: „Es gibt den Dönermann, aber nicht die Dönerfrau!“ Ayla nennt Dönerläden in Berlin, in denen sie schon Frauen hat arbeiten sehen. Auch die anderen Thesen werden mit erlebter Evidenz widerlegt. „Meine Tante kann besser Auto fahren als mein Onkel“, sagt ein Junge leise zu seinem Sitznachbarn. Tradierte Klischees treffen auf den Alltag von Kindern, die all das eigentlich gut kennen: Arbeitende Frauen, die logisch denken und handeln können. Und auch die Jungen scheinen ihre eigenen Vorurteile nicht ganz zu glauben. Anders bei den Mädchen. Ceyda: „Jungs können nicht ihre Gefühle zeigen.“ Ohrenbetäubendes Geschrei von den Jungs. Malik: „Das waren doch jetzt Gefühle.“ Ceyda: „Aber zwischen Wut und Gefühlen gibt es einen Unterschied. Das Einzige, was ihr zeigt, ist Wut.“ Es folgen Gegenbeispiele. Jungs würden um Mädchen weinen. Oder beim Fußball, wenn sie sich verletzt haben. Doch die Mädchen geben nicht klein bei. Jungs würden anders denken. Sie „boxen und schlagen“ da, wo Mädchen höchstens „petzen“ würden. Auf einen Punkt können sich schließlich die meisten einigen. Hadice: „Nur Frauen können gebären.“ Schüler: „Was heißt gebären?“ Lehrerin: „Kinder kriegen.“ Schüler: „Ja, das weiß ja jeder.“ Zumindest dann, wenn in der Schwangerschaft nichts schieflaufe, fügt er noch an. Und dennoch: „Wir können nicht schwanger werden, aber haben ja trotzdem Kinder“, sagt Taner. Gleich ist der Unterricht zu Ende. Die Kinder gehen zurück auf ihre Plätze, die Diskussion ist beendet. Die Lehrerin möchte ihnen noch einen Gedanken mit auf den Weg geben. „Kann es sein, dass sich mit Wörtern bestimmte Vorstellungen hervorrufen lassen?“ Sie spricht von der Macht der Sprache. Könnte es einen Unterschied machen, ob etwa von Lehrern die Rede ist oder von Lehrerinnen? Vielleicht sogar von Lehrer:innen? Vereinzeltes Nicken. Dann verlassen die Kinder den Raum. Das Whiteboard erlischt, die rosa und blauen Federmappen sind von den Tischen verschwunden. Es heißt ständig, dass unsere Gesellschaft gespalten sei. So als hätte es da irgendwann etwas Ganzes gegeben. Schon lange ist von Polarisierung, von Gräben die Rede. Das Gespaltene war auch in den Kindern zu erkennen. Die Klischees auf der einen Seite. Der neugierige und aufgeschlossene Umgang mit Sprache und Identität auf der anderen. Die Gleichzeitigkeit des vermeintlich Ungleichzeitigen scheint ohne Brüche und Widerspruch in ihnen zu sein. Es ist das, was sie jeden Tag erleben. Kurz bevor er den Klassenraum verlässt, spricht Taner nochmal die Lehrerin an. Die Gruppenarbeit habe ihm nicht so richtig gefallen. Denn: „Eigentlich können Jungs und Mädchen alles machen. Aber wir sollten ja nach den Unterschieden suchen, also haben wir welche gefunden“, sagt er. Hinweis: Auch die Namen der Schülerinnen und Schüler wurden verändert",NA
"3",3,1904,1904,"https://taz.de/Gender-Leitfaden-in-Oesterreich/!5900693/","2022-12-20T12:00:00+01:00","Gender-Leitfaden in Österreich: Doch nicht so korrektes Kärnten","Ralf Leonhard","In Kärnten hat die Landesregierung nach großer Aufregung einen Leitfaden für gendergerechte Sprache zurückgezogen.","Österreich, Kärnten, Gendergerechte Sprache, Debatte, Gesellschaft, taz, tageszeitung ","Wenn die Political Correctness verlangt, dass der Bauer zum landwirtschaftlich Beschäftigten und der Gast zur Besuchsperson wird, schütteln in Kärnten viele den Kopf. Nicht nur die landwirtschaftlich Beschäftigten. Ein Leitfaden nebst Wörterbuch für gendergerechte Sprache der Kärntner Landesregierung für den Amtsverkehr hat so viel Staub aufgewirbelt, dass er vorerst zurückgezogen wurde. „Genderwahnsinn“, tobte der Kärntner FPÖ-Chef Erwin Angerer. Für ÖVP-Landesrat Martin Gruber wird da eine „Verhunzung“ der Sprache betrieben: „Irgendwann muss damit Schluss sein, bei aller Wertschätzung auch für Gleichberechtigung.“ Tatsächlich finden sich in dem Wörterbuch Vorschläge, die ein Schmunzeln hervorrufen können. Etwa dass der „Hausmeister“ künftig „Fachkraft für Gebäudemanagement“ genannt werden soll. Die meisten der Anregungen erscheinen aber vernünftig. Zum Beispiel das Ersetzen von Nomina durch Gliedsätze. Beispiel: „Wer teilnimmt“ statt „die Teilnehmer und Teilnehmerinnen“. Sporadisch solle man Passivkonstruktionen nutzen: „Im Workshop wurde ein Empfehlungskatalog erstellt“ statt „Die Teilnehmerinnen und Teilnehmer des Workshops erstellten einen Empfehlungskatalog“. Wenn andere geschlechtsneutrale Formulierungen ausgeschöpft sind, solle man statt Binnen-I den Doppelpunkt einsetzen (Richter:innen), weil es nichtbinäre Identitäten berücksichtigt. Die von Landeshauptmann Peter Kaiser (SPÖ) geführte Landesregierung beruft sich auf eine Erkenntnis des Verfassungsgerichtshofs (VfGH) von 2018, die sich wiederum auf Artikel 8 der Europäischen Menschenrechtskonvention (EMRK) stützt und eine dritte Geschlechtskategorie anerkennt. Kaiser hat nach Jahren der populistischen FPÖ-Regierungen wieder Sachlichkeit in die Kärntner Landespolitik gebracht. Vor den Landtagswahlen am 5. März will er den Rechten offenbar den „Genderwahnsinn“ nicht als Wahlkampfthema schenken. Fünf von neun Bundesländern sowie die Stadt Graz haben ähnliche Leitfäden schon ohne großes Getöse beschlossen. Kaiser schließt sein Schreiben, mit dem das Wörterbuch vorläufig zurückgezogen wird, deshalb mit einer „nachdrücklichen Aufforderung an die Bundesregierung, schnellstmöglich ein solches Nachschlagewerk österreichweit einheitlich sicherzustellen“.",NA
"4",4,3856,3856,"https://taz.de/Antidiskriminierung-an-der-TU-Hamburg/!5658694/","2020-02-08T08:00:00+02:00","Antidiskriminierung an der TU Hamburg: Ohne Outing auf die Toilette","Philipp Steffens","Die Technische Universität Hamburg hat genderneutrale Toiletten eingeführt. Der Asta sorgt sich vor protestierenden Falschpinkler*innen.","Sexuelle Identität, Gender, Toiletten, Universität, Nord, taz, tageszeitung ","HAMBURG taz | Nicht jedes Mal, wenn man pinkeln muss, sollte man sich outen müssen. Nicht jedes Mal, wenn man eine öffentliche Toilette sucht, sollte man sich fundamentale Fragen über das eigene Geschlecht stellen müssen. Manchmal muss man einfach nur schnell aufs Klo. Dass dieser Grundsatz in der Realität für manche Menschen schwierig umzusetzen ist, hat nun auch die Technische Universität Hamburg (TUHH) erkannt und Anfang Februar Toiletten für alle Gender sowie Toiletten für Frauen, Lesben, Intersexuelle, Nichtbinäre und Transsexuelle eingeführt. Damit versucht die TUHH, allen Studierenden unabhängig von Geschlecht oder sexueller Orientierung einen ungestörten Rückzugsraum zu geben. „Die Umwandlung zeigt, dass die TUHH eine weltoffene und tolerante Universität ist“, sagt Kerstin Kuchta, Vizepräsidentin für Lehre. „Dies ist ein Baustein für mehr gelebte Diversität auf dem Campus der TUHH“, meint auch die Gleichstellungsbeauftragte der Universität, Nicolli Povijač. Insgesamt sind nun drei Toiletten genderneutral und drei sind für Frauen, Intersexuelle, Nichtbinäre und Transpersonen ausgewiesen. Mit Schildern an den Eingangstüren versucht der Allgemeine Studierendenausschuss (Asta) das Konzept zu erklären und Akzeptanz zu schaffen. Dass der Weg zur Gleichberechtigung nicht einfach ist, zeigt ein Gesprächsprotokoll des Studierendenausschusses. Darin stellt der Asta fest, dass das Konzept aus Protest absichtlich falsch genutzt werden könnte. Schließlich sei die Trennung Mann–Frau bei vielen fest verankert. Auch ist das Benutzen einer Toilette beispielsweise für Trans- und Intersexuelle immer noch ein Outing. Und auch eine absolute Gleichstellung aller Geschlechter ist durch das neue Toilettenkonzept nicht gegeben, sinniger wären einzelne Kabinen, die für alle zugänglich sind. Es bleibt trotzdem ein mutiger Schritt, an öffentlichen Orten auf Diversität hinzuweisen und allen Menschen eine Möglichkeit zu geben, ohne Angst oder Selbstzweifel an einer Universität die ­Toilette aufzusuchen. Das über etwas, das selbstverständlich sein sollte, überhaupt diskutiert und geschrieben werden muss, zeigt, wie weit öffentliche Bildungseinrichtungen noch von tatsächlicher Gleichbehandlung aller entfernt sind. Dabei muss jede*r manchmal einfach nur aufs Klo.",NA
"5",5,7496,7496,"https://taz.de/Gender-Gap-im-Konjunkturpaket/!5686625/","2020-06-04T19:11:00+01:00","Gender Gap im Konjunkturpaket: Dem Backlash ausgeliefert","Patricia Hecht","Die Corona-Krise ist eine Gender-Krise. Trotzdem spielt geschlechtergerechte Budgetierung keine Rolle im Konjunkturpaket der GroKo. Geht's noch?","Konjunkturpaket, Backlash, Geschlechtergerechtigkeit, Gender Pay Gap, Coronavirus, Deutschland, Politik, Schwerpunkt, taz, tageszeitung ","Wie oft kommt das Wort „Frauen“ im Papier zum Konjunkturpaket der Bundesregierung vor? Gar nicht. Das Wort „Geschlechtergerechtigkeit“? Gar nicht. Und das Wort „Care“? Genau: gar nicht. Die Coronakrise ist eine Krise der Geschlechter. Mütter ziehen sich aus dem Arbeitsmarkt zurück, der Gender Pay Gap wird aller Voraussicht nach noch weiter auseinanderklaffen als ohnehin schon, von der Rentenlücke ganz zu schweigen. Unbezahlte Care Arbeit wird noch mehr als zuvor von Frauen übernommen, was wiederum eins zu eins mit schlechteren Chancen auf dem Arbeitsmarkt verknüpft ist. Frauen gehen als Verliererinnen aus der Krise hervor. Und dieses Konjunkturpaket steuert dem nicht aktiv entgegen. Jenseits der Alleinerziehenden, die weit überwiegend weiblich sind, werden Frauen als ökonomische Gruppe nicht adressiert. Zwar kommen einzelne Maßnahmen auch Frauen zugute – nebenbei, nicht offensiv, und als eine Art Abfallprodukt dessen, dass das Paket nun mal für Menschen gemacht wurde, also auch für Frauen. Aber dass Geschlechterpolitik eine Querschnittsaufgabe ist, die ressortübergreifend in jeder Maßnahme mitgedacht werden muss, ist der Bundesregierung ganz offensichtlich gar nicht in den Sinn gekommen. Doch vor wenigen Tagen noch hatte Frauenministerin Franziska Giffey (SPD) in der Bild am Sonntag gefordert, genau dies zu tun: „Die Auswirkungen auf Frauen bei allen Coronamaßnahmen“ zu prüfen und überdies Geschlechtergerechtigkeit in Unternehmen zur Bedingung für die Vergabe von Staatshilfen zu machen – eine für Giffey geradezu radikale Position. Davon übrig geblieben ist nichts. Das heißt nicht, dass überhaupt nichts beschlossen wurde, was frauenpolitisch begrüßenswert wäre. Der Entlastungsbetrag für Alleinerziehende zum Beispiel wird zwei Jahre lang verdoppelt. Es gibt 300 Euro Kinderbonus, der nicht auf die Grundsicherung angerechnet wird und der Familien zugute kommt (also durchaus auch Männern). Und einige Branchen, in denen viele Frauen arbeiten, werden ebenfalls unterstützt, zum Beispiel die Reise. Doch die Forderung lautet Gender Budgeting, also geschlechtergerechtes Haushalten, das in diesem Paket ganz idealtypisch hätte berücksichtigt werden können. Und überdies gäbe es steuer- und arbeitsmarktpolitische Maßnahmen, die nicht nur kurz-, sondern auch langfristig darauf hingewirkt hätten, einen Einbruch der Wirtschaft zu verhindern: Das Kurzarbeitergeld erhöhen, um Erwerbstätige mit niedrigem Einkommen, also vielfach Frauen, vor einem Abrutschen in die Armut zu schützen. Höhere Tarife für Branchen, in denen vor allem Frauen beschäftigt sind, zum Beispiel Reinigung, Einzelhandel und Pflege. Statt einer Kaufprämie für Elektroautos eine für Fahrräder, die neben dem Öffentlichen Nahverkehr ein Verkehrsmittel sind, mit dem Frauen verstärkt ihre Wege zurücklegen. Das Rückkehrrecht von Teilzeit in Vollzeit ausbauen, gerade jetzt, da viele Frauen sich in Teilzeit verabschieden oder noch weiter reduzieren. Mehr Anreize für Teilzeitarbeit von Vätern. Mehr Vätermonate in der Kinderbetreuung. Ehegattensplitting abschaffen. Quote, Quote, Quote. Es hätte mit diesem Konjunkturpaket die Chance gegeben, handfesten finanziellen Ausgleich zu schaffen und zudem geschlechterpolitisch Weichen zu stellen, um dem enormen gleichstellungspolitischen Backlash durch die Krise entgegen zu steuern. So bleiben Frauen in dem Paket weitgehend unsichtbar. Und wer nicht gesehen wird, kann kaum profitieren",NA
