"","X.2","X.1","X","url","date","title","author","description","keywords","body","error"
"30",30,30429,30429,"https://taz.de/Autorin-ueber-Alkoholmissbrauch/!5853848/","2022-05-27T18:47:00+01:00","Autorin über Alkoholmissbrauch: „Trinken wird eben auch gegendert“","Sophia Zessnik","Als emanzipierte Frau sollst du trinken wie ein Mann, sagt die Food-Journalistin Eva Biringer, die selbst ein Alkoholproblem hatte.","Alkoholmissbrauch, Pandemie, Feminismus, Gesundheit, Gesellschaft, Schwerpunkt, taz, tageszeitung ","taz: Frau Biringer, während der Alkoholkonsum in den vergangenen Jahren generell abgenommen hat, steigt er bei einer Gruppe: beruflich erfolgreichen Frauen ab 30 Jahren. Ist Alkoholismus etwa eine Begleiterscheinung des Feminismus? Eva Biringer: Ich bin der Meinung, dass es Frauen als emanzipativ verkauft wird, zu trinken. Die Serie „Sex and the City“ (SatC) ist immer noch mein Lieblingsbeispiel: Als erfolgreiche Frau in einem coolen Job, finanziell unabhängig, gehört der After-Work-Drink zum Lifestyle dazu. In Ihrem Buch „Unabhängig“ schrei­ben Sie: „Die Zukunft ist weiblich, der Wein ist pink“. Ist das nicht ein arges Klischee? Dabei handelt es sich um ein Zitat der US-Autorin Holly Whitaker („Quit Like a Woman“) und ja, es klingt nach Klischee, aber auf gewisse Weise wird Trinken eben auch gegendert. Rosé-Sekt oder der Cosmopolitan wie bei SatC sind zu Symbolen eines gewissen Glamours geworden. Die Psychotherapeutin Ann Dowsett Johnston spricht in diesem Zusammenhang von einer „Feminisierung der Trinkkultur“. Und tatsächlich besteht ein nachweisbarer Zusammenhang zwischen dem Grad an Emanzipation in einem Land und dem Anteil trinkender Frauen. Woran liegt das? Als emanzipierte Frau sollst du machen, was Männer auch machen. Also kannst beziehungsweise sollst du auch trinken wie ein Mann. Wobei es hier zu einem gewissen Paradoxon kommt. Inwiefern? Man bewegt sich als Frau auf einem schmalen Grat: Gar nicht trinken ist komisch – dann bist du entweder schwanger, nimmst Medikamente oder hast ein Alkoholproblem. Zu viel trinken geht aber auch nicht, da läuft man besonders als Frau Gefahr, schnell stigmatisiert zu werden. Eine Freundin von mir hat das mit dem gesellschaftlich akzeptierten Körperbild verglichen: Zu dick sein darfst du keinesfalls – zu dünn sein aber auch nicht. Sie schaffen eine Verbindung zwischen dem exzessiven Alkoholkonsum von Frauen und dem Wunsch, dünn zu sein. Stichwort: Drunkorexia. Essstörungen und Alkohol sind eine sehr gängige Kombination. Viele, die an Bulimie oder Anorexia nervosa, also Magersucht, leiden, trinken. Erst mal passt das gar nicht zusammen, schließlich hat Alkohol viele Kalorien und erhöht den Kontrollverlust. Gerade bei Anorexia geht es hingegen darum, die Kontrolle zu behalten und möglichst wenig Kalorien aufzunehmen. Schaut man genauer hin, passen beide Verhaltensmuster aber doch gut zusammen. Du kannst nicht immer kontrolliert sein, und da ist das Trinken für viele der vermeintliche Ausweg, loslassen zu können. Bei mir war es jedenfalls so: Trinken war der Exzess, den ich mir sonst verboten habe. Sie arbeiten als Food-Journalistin und haben nun aufgehört Alkohol zu trinken. Ist das vereinbar? Ich höre den Satz seltener als anfangs gedacht, aber wenn, kommt er immer von Männern: Du schreibst über Essen und trinkst nicht? Du musst doch was zum Wein sagen können. Was ist Ihre Antwort? Nein, ich muss nichts zum Wein sagen können. Erstens gibt es mittlerweile ganz wunderbare alkoholfreie Getränkebegleitungen. Zweitens, und das ist wichtiger: Ich habe oft vom Essen kaum etwas mitbekommen, weil ich schon ab der zweiten Vorspeise besoffen war. Das passiert in meiner Branche gar nicht so selten, schließlich ist Alkohol da sehr präsent. Auf Pressereisen wird ständig getrunken; man muss die Jour­na­lis­t*in­nen ja bei Laune halten. Im Food-Bereich beginnt man den Tag gern mal mit einem Schnapsbrennereibesuch. Auf diesem Grat zu wandeln war schwer: Ich hatte das Gefühl, mittrinken zu müssen, um nicht aus der Rolle zu fallen, und gleichzeitig durfte ich nicht zu viel trinken. Denn das wäre ja unprofessionell. Mit elf Jahren haben Sie angefangen, Alkohol zu trinken. Von da an hat sich Ihr Konsum mit den Jahren immer weiter gesteigert. Haben andere Menschen Sie auf Ihren Alkoholkonsum angesprochen? Kaum. Ein Ex-Freund von mir, ein Sommelier, hat mal nach einer exzessiven Nacht gesagt: Eva, ich will dich so nicht mehr sehen. Das war eine Ansage. Aber sonst hat niemand was gesagt. Ich bin aber auch sehr offen mit meinem Konsum umgegangen, weil ich dachte, das würde mich schützen. Wovor? Ich dachte, die Kontrolle zu behalten, wenn ich ehrlich damit umgehe, dass ich viel trinke. Freun­d*in­nen erzählte ich von meinen Abstürzen, auf meinem Instagram war alles voll mit Weinflaschen und Drinks. Ich rechnete Ausgaben sogar in meinen Lieblingsdrink um – mein Wechselkurs war der Negroni-Index. Wie lange hat es gedauert vom Realisieren, dass Sie ein Alkoholproblem haben könnten, bis zum Entschluss, nüchtern zu werden? Im Prinzip dauerte es circa 12 Jahre. Mit Anfang 20 habe ich den Uni-Psychologen gefragt, ob es ein Problem sei, dass ich jeden Tag zwei Gläser Wein trinke. Er gab mir einen ausgedruckten taz-Artikel von Daniel Schreiber in die Hand mit. Den habe ich heute noch. Im Grunde wollte ich damals keine Antwort, es aber mal formuliert haben. Offensichtlich hatte ich aber bereits die selbstkritische Überlegung, dass es nicht cool ist, jeden Tag zu trinken. Zudem fand ich Tage, an denen ich nicht trinken konnte, doof. Auch ein Zeichen. Trotzdem haben Sie weiter getrunken? Ja, es war ein langer Prozess. Ich wollte immer was erleben und habe deshalb getrunken. Das ist für Frauen weniger typisch. Männer neigen eher dazu, Erlebnistrinker zu werden. Viele Frauen trinken, um ihre Gefühle zu unterdrücken, um endlich mal abzuschalten und nicht ständig diesem mental load ausgesetzt zu sein. Die Pandemie war da nicht gerade hilfreich. Ja, soziale Trinker haben in der Pandemie weniger getrunken, da die Anlässe durch geschlossene Clubs und Bars wegfielen. Bei Menschen, die aber vorher schon dazu tendiert haben, alleine und/oder bei Problemen zu trinken, hat sich der Alkoholkonsum erhöht. Besonders unter Müttern ist er gestiegen, da sie durch die zunehmende Care-Arbeit einer hohen Belastung ausgesetzt waren. Sie schreiben, Sie seien der Meinung, dass sich die Politik aktiv dagegen entscheide, einen Beitrag zur Gesundheit der Bevölkerung zu leisten. Wie meinen Sie das? Es ist klar, dass Deutschland ein Alkoholproblem hat. Die Zahlen unterscheiden sich je nach Erhebung, aber Deutschland ist immer vorne mit dabei, was den Pro-Kopf-Verbrauch betrifft. Weltweit sterben mehr Menschen durch Alkohol als durch Verkehrsunfälle, illegale Drogen und Verbrechen. Da entstehen für das Gesundheitssystem immense Kosten, um für alkoholbedingte Ausfälle und Behandlungen aufzukommen. Aber darum kümmert sich die Politik hierzulande nicht, weil die Lobby so groß ist. Sabine Bätzing-Lichtenthäler (SPD), die letzte Politikerin, die aktiv versucht hat, etwas zu ändern, ist quasi aus dem Amt gejagt worden. Dabei helfen Steuererhöhungen und ein Werbeverbot, den Alkoholkonsum zu regulieren. Erfolgreiche Beispiele dafür sind Island oder Schottland. Sie vertreten die gewagte These, dass Alkoholismus „keine Krankheit, sondern eine verdammt blöde Angewohnheit“ ist. Ja, das ist meine Meinung. Aber ich möchte hier differenzieren. Wenn du körperlich abhängig bist, ist es keine Gewohnheit mehr, dann ist es eine Krankheit. Bis dahin ist es aber ein langer Weg. Die Frage ist: Wo fängt Abhängigkeit an? Bin ich schon abhängig, wenn ich jeden Tag einen Drink trinke, aber nie betrunken bin? Oder bin ich nur abhängig, wenn ich beim Trinken nicht aufhören kann? Und was ist mit denen, die abstürzen, dann monatelang gar nicht trinken? Letztlich geht es um Selbsteinschätzung. Also würden Sie sich nicht als Alkoholikerin bezeichnen? Nein. Ich hab beispielsweise nie morgens getrunken, ich konnte auch einen Monat nicht trinken und trotzdem war ich abhängig, – aber war ich Alkoholikerin? Ich mag den Begriff und das Bild, das er vermittelt, einfach nicht. Deswegen tue ich mich auch schwer mit „Anonymen Alkoholikern“. Die dort propagierte Auffassung, mein Ego erst mal klein machen und mich bei anderen entschuldigen zu müssen, wird meiner Lebensrealität nicht gerecht. Sondern? Ich orientiere mich da an feministischen Perspektiven aus der sogenannten sober scene. Dort heißt es, besonders Frauen sei in ihrer Abhängigkeit nicht geholfen, wenn sie sich erst mal klein machen. Als Frau entschuldigt man sich sowieso schon viel zu viel für alles Mögliche. Als Erstes muss ich mich bei mir selbst entschuldigen. Dafür, was ich meinem Körper und meiner Seele angetan habe.",NA
"31",31,31314,31314,"https://taz.de/Geschlechterrollen-im-Kinderfilm/!5853590/","2022-05-28T10:00:00+01:00","Geschlechterrollen im Kinderfilm: Gendertypische Kätzchen","Eiken Bruhn","Mit großen Krisen der Gegenwart und Zukunft will die Kolumnistin bei ihren Kindern keine Panik schüren. Eine Ausnahme macht sie fürs Patriarchat.","Patriarchat, Geschlechterrollen, Gender, Kinderfilm, Kolumne Beim Friseur, Nord, Serie, taz, tageszeitung ","Insgesamt scheint auch der Enthusiasmus abgenommen zu haben, mit gelb-blauen Flaggen zu wedeln, und in der Schulen geht es wieder um vergangene Kriege, als wäre das alles Geschichte. Mir kommt das gelegen, denn Anfang April hatte eins meiner Kinder nach der „Thematisierung des Krieges im Unterricht“ eine solide Angst vor einem Atomkrieg mitgebracht. Meine Taktik war bis dahin gewesen, meinen Kindern die gruseligen Details des Krieges vorzuenthalten und nur dann mit der Sprache rauszurücken, wenn sie mich von sich aus darauf ansprechen. So hatte ich es bisher auch mit der Klimakrise gehalten. Ich sehe keinen Sinn darin, ihnen die Ängste einzutrichtern, die ich selbst täglich mühsam verdrängen muss. Mir scheint Panik auch nicht der direkte Weg zu einer besseren Welt, aber ich mag mich täuschen. Als ich neulich über meine Ausweichmanöver nachdachte, wurde mir klar, dass meine Kinder das Patriarchat für das größte Übel der Welt halten. Weil: Darüber rede ich mit ihnen lang und ausführlich, was ich manchmal bereue, weil es einem ja schon die Laune verderben kann, wenn man sich die anhaltende Diskriminierung von allen, die nicht einwandfrei männlich gelesen werden können, vor Augen führt. Als Kind habe ich beispielsweise den Disney-Film „Aristocats“ geliebt, aber als ich ihn meinen Kindern vorführte, schäumte ich vor Wut über die Geschechterstereotype und stoppte zu ihrem Leidwesen den Film mehrfach für Kurzreferate. „Habt ihr das gesehen?“, geiferte ich. „Die beiden männlichen Kätzchen erkunden die Welt und erschaffen Kunstwerke“ (ist halt ein Film) „und ihre Schwester muss permanent gerettet und getragen werden und ihre Gedanken kreisen darum, wie sie so schön wie Maman sein kann.“ Noch wütender war ich, als ich kurz darauf las, dass Disney den Film nicht mehr im Kinderkanal zeigt. Aber nicht wegen der diskriminierenden Darstellung von weiblichen Katzenkindern. Sondern weil ein Musiker der Straßenkatzen-Band, der in wenigen Filmminuten zu sehen ist, eine Siamkatze ist. Mit Schlitzaugen. Die Klavier und Schlagzeug mit Essstäbchen spielt. Das sei rassistisch, so Disney, und alle applaudieren. Da mag ja etwas dran sein. Aber warum wird es allgemein für unproblematisch gehalten, wenn Kinder täglich in Büchern, Filmen und Hörspielen auch jüngeren Datums erfahren, dass Jungs cool sind und etwas erleben, während Mädchen sich um ihr Aussehen und verlassene Tiere kümmern? Aristocats lohnt sich übrigens trotzdem anzuschauen. Wenn sich die Hunde Napoleon und Lafayette mit dem bösen Diener Edgar eine wilde Verfolgungsjagd liefern, muss ich auch heute noch so lachen, dass ich meine Wut vergesse.",NA
"32",32,32102,32102,"https://taz.de/Sprachkritiker-Schneider-gegen-Gendern/!5872467/","2022-08-04T14:49:00+01:00","Sprachkritiker Schneider gegen Gendern: Vor Wölfen wird gewarnt","Steffen Grimberg","Der ehemalige Journalist und „Sprachpapst“ Wolf Schneider mokiert sich übers Gendern. Dabei hat er nichts verstanden, findet unser Autor.","Gendern, Wolf Schneider, Stern, Kolumne Flimmern und Rauschen, Kolumnen, Gesellschaft, Serie, taz, tageszeitung ","Vor Wölfen wird gewarnt. Also jetzt nicht vor den possierlichen Tierchen, die dafür sorgen, dass sich in Brandenburg überhaupt mal wieder wer oder was bewegt. Nein, Vorsicht ist vor den menschlichen Wölfen geboten. Besonders, wenn sie was mit Medien machen. Erst war da Prälat Wolf beim Rundfunkrat der Bayern mit seiner Verstrickung in den Missbrauchsskandal der katholischen Kirche. Dann kam der Messe-Wolf im RBB-Verwaltungsrat daher, der knietief im Compliance-Sumpf beim Hauptstadtsender steckt. Und jetzt haben wir einen alten weißen Wolf aus Starnberg am See, zu dem viele Jour­na­lis­t*in­nen früher mal aufgeschaut haben. „Deutsch für Profis“ heißt seit 1982 ein Klassiker der Journalismus-Ausbildung und verspricht „Wege zu gutem Stil“. Geschrieben hat das Buch Wolf Schneider. Der war gefühlte Ewigkeiten selbst Journalist bei Stern und Welt und dann mindestens genauso lange Leiter der „Hach, darf die noch so heißen“-Schule in Hamburg. Apropos, hallo Stern! Was ist denn jetzt mit Henri Nannen, nach dem die bekannteste Jour­na­lis­t*in­nen­schu­le der Republik benannt ist? Wolf Schneider war damals top. Dicht dran an der Zeit und ihrer Sprache. „Sprachpapst“ wurde er von vielen genannt. Dann veränderte sich die Gesellschaft, doch der Wolf kam nicht mehr mit und wurde zum elitären alten S…, pardon, schlechter Stil. Denn Schneider geriert sich als Sprach­bewahrer, was in seinem Fall aber Gesellschaftliche-Entwicklung-Verhinderer heißt. Aus Schneider, dem Gutsprecher wurde Schneider, der Sprachbarrierist. „Gendern ist für Wichtigtuer“, greint er also diese Woche in der Bild. Und zwar von Leuten, die „von Sprache keine Ahnung haben. Zwischen dem natürlichen und dem grammatischen Geschlecht besteht nicht der geringste Zusammenhang“, behauptet Schneider. „Wie könnte es sonst das Weib heißen?“, so der „Sprachpapst“ allen Ernstes. Rad­fah­re­r*in­nen ist auch keine „Verhohnepipelung der deutschen Sprache“, wie Schneider Bild in den Blog diktiert. Da muss sich der alte weiße Wolf bloß mal die Realität mit der E-Bike-Dichte am Starnberger See angucken. Zum Beweis, dass er rein gar nichts verstanden hat, folgt dann noch das Satz „Die Führungskraft ist heute überwiegend ein Mann und keiner hat sich je beschwert.“ Genau, mein Sprachführer! Außer vielleicht jene Frauen, die den Männern jetzt diese Führungskräfte streitig machen, wovor ihr Angst habt. „Wolf Schneider mach dich vom Acker! Hier kommen die Frauen mit ihrer Version von Sprache!“, meint die Mitbewohnerin. „Die bekannteste Wölfin ist sowieso viel älter als Sprachgeschichte und ihre Päpste und bedeutsamer als alle drei Möchtegern-Wölfe hier. Ab jetzt wird Geschichte neu erzählt. Nix böser Wolf, sondern nur noch gute Wölf*innen!“",NA
"33",33,32226,32226,"https://taz.de/Gendergerechte-Sprache/!5867685/","2022-08-03T15:16:00+01:00","Gendergerechte Sprache: Krieg der Sternchen","Steve Ayan","Warum erhitzt der Genderstreit so sehr die Gemüter? Weil man sich dazu nicht nicht verhalten kann. Ein Auszug aus dem Buch „Was man noch sagen darf“.","Gender, Gender-Sprache, Deutsche Sprache, Gendergerechte Sprache, GNS, Debatte, Gesellschaft, Feed, taz, tageszeitung ","Die Debatte um Gendersternchen wird oft hochemotional geführt. Das könnte damit zusammenhängen, dass sich viele durch sie an den Rand gedrängt fühlen: Man wird genötigt, mitzuspielen oder sich zu erklären. Sprache steht nie still. In den letzten Jahren kam es in Mode, sie von Altlasten befreien zu wollen, vom Geist einer Zeit, als der Mann das Geld verdiente, die Frau sich um die Kinder kümmerte und Minderheiten immer für einen Scherz gut waren. Mit diesen Bildern wollen sich die meisten von uns nicht mehr identifizieren. Das Motiv ist also einfach: Gleichberechtigung. Alle mitmeinen. Nicht verletzend oder vorurteilsbehaftet über andere sprechen. Wer diesen Wunsch teilt, kann kaum anders, als ab sofort „Mitarbeiter*innen“ oder „Forschende“ zu schreiben und durch Sprechpausen das Mitmeinen aller anzuzeigen. Oder nicht? Zwar umfasst das generische Maskulinum grammatisch durchaus beide (oder alle) Geschlechter, dennoch wollen viele die Sichtbarkeit des „anderen“ erhöhen. Das ist legitim. Und doch regt sich Unmut: Wird die Sprache so nicht mutwillig verschandelt? Es gibt Situationen, in denen das Vermeiden generischer Maskulina tatsächlich gestelzt wirkt. Man kann es trotzdem gutheißen, weil Irritation Nachdenken auslöst. Menschen denken in der Tat stärker an weibliche Vertreter einer Zunft, wenn gegenderte Formen verwendet werden. Laut schwedischen Forschern um Anna Lindquist von der Universität Lund ist es für das Mitmeinen dabei wichtig, durch explizite Nennung beider Geschlechterformen oder durch kreative Neuschöpfungen wie das schwedische „hen“, eine Mischform aus den Pronomen er („hon“) und sie („han“), Gewohnheiten zu durchbrechen. Weicht man hingegen einfach auf neutrale Varianten aus (etwa den englischen Plural „they“), verbinden Testpersonen damit oft primär den männlichen Standard. Doch was ist damit letztlich gewonnen? Nach dem initialen Denkanstoß setzt früher oder später die Gewöhnung ein. Irgendwann ist “Studierende„ einfach das Wort für ehedem „Studenten“. Warum man das Partizip einst wählte, verblasst. Das Moralisieren des Mitmeinens (Wer nicht gendert, hat etwas gegen Gleichberechtigung) fördert die Zersplitterung. Oder wie kommt es, dass viele so erbittert um Sternchen und Partizipien streiten? Ist es nicht einfach nur zeitgemäß, sprachliche Konventionen im Sinn der Gleichberechtigung zu reformieren? Das Problem ist die Doppelbödigkeit dieses scheinbar harmlosen Wunsches, denn das Gendern setzt viele Menschen unter Druck. Jeder sieht plötzlich alt aus, der weiter generische Maskulina benutzt. Man fühlt sich an den Rand gedrängt; wird genötigt mitzuspielen oder sich zu erklären. Man kann sich nicht nicht zum Gendern verhalten. Diese Form der Nötigung hat das Zeug zum Aufreger. So ergab eine Untersuchung an 168 schwedischen Probanden, die ein Team um die Stockholmer Psychologin Hellen Vergoossen 2020 veröffentlichte, dass die Angst, in der persönlichen Redefreiheit eingeschränkt zu werden, eine besonders emotionale Ablehnung des Genderns hervorruft. Je mehr sich die einen über die Rückständigkeit der Verweigerer empören, desto erbitterter keifen diese zurück. Darüber gerät die Arbitrarität sprachlicher Zeichen aus dem Blick: Die Beziehung zwischen Zeichen und Bezeichnetem ist beliebig. Ob die Lautfolge “Baum„, “tree„ oder “arbre„ große Gewächse meint, hat keinerlei tieferen Grund. Diese Wörter wurden im Lauf der Zeit gebräuchlich, doch im Prinzip könnten es auch andere sein. Diese Beliebigkeit anzuerkennen hilft, die Realität nicht mit ihrem sprachlichen Ausdruck gleichzusetzen – ein Irrtum, dem rasch erliegt, wer eine Sprechweise unmittelbar an das Denken und die Weltsicht des Sprechers knüpft. Gendern allein verändert die Denkweise von Menschen oder die Rolle von Frauen in der Gesellschaft noch nicht. Es birgt sogar umgekehrt die Gefahr, dass eine „korrekte“ Sprechweise als Signal für Gleichberechtigung dient, ohne dass diese wirklich gelebt wird. Weshalb also werden grammatische Details zu Fragen von Wohl und Wehe stilisiert? Nach dieser Logik dürfte es gar keine bedeutungslosen Formalismen in der Sprache geben. Alles hätte eine tiefere Bedeutung, verwiese auf eine Haltung. Rückt nicht das englische „How are you?“ das Sein viel stärker in den Fokus als das deutsche „Wie geht es dir?“ Denken Deutsche deshalb irgendwie „beweglicher“ als US-Amerikaner? Nichts Sprachliches dem Zufall zu überlassen, zeugt von einer Hypersensibilität, die alles mit Bedeutung auflädt. Doch wir schreiben Bedeutung zu; sie ist nicht einfach gegeben. Daher rührt auch die vermeintliche Unfehlbarkeit sprachpolizeilicher Verdächtigungen: Sobald man einen Ausdruck als inakzeptabel etikettiert, ist er das. Man kann Redeweisen verändern, um auszudrücken, was einem wichtig ist. Nur sollte man nicht glauben, die Veränderung bliebe dort stehen. Die Sprache wandelt sich ständig weiter, durch Gewöhnung, Umdeutung, Ironisierung, Übertragung auf neue Zusammenhänge. Begriffe wie „queer“ wurden von der so einst verunglimpften Gruppen selbst zur stolzen Eigenbezeichnung umfunktioniert. Ein Akt der Selbstermächtigung, der das Verletzende nicht tilgt, sondern es benutzt, um sich nicht mehr verletzen zu lassen. Redeweisen zu tabuisieren, unterbindet solche kreativen Verschiebungen. Manche fragen: Gibt es überhaupt noch Tabus? Leben wir nicht in einer Zeit totaler Enthemmung? Wie das Gendern offenbart, wandeln sich Tabus zwar, aber sie verschwinden nicht. Sie dienen nicht mehr dem Machterhalt einer Elite, sondern dem Versuch, eine Sparversion von Macht, die Deutungshoheit, zu erringen. Nur sollte man nicht so blauäugig sein, zu glauben, dass die Welt schon eine andere ist, weil man anders redet.",NA
"34",34,32847,32847,"https://taz.de/Gendergerechte-Sprache-in-Antraegen/!5873436/","2022-08-24T11:09:00+02:00","Gendergerechte Sprache in Anträgen: Guten Tag Divers Max Mustermann","Alina Götz","Schleswig-Holstein bietet viele behördliche Anträge online. Die Auswahl im Feld „Anrede“ varriiert dabei. Im Extremfall führt dies zu Peinlichkeiten.","Schleswig-Holstein, Gendergerechte Sprache, Digitalisierung, Transpersonen, Gender und Sexualitäten, Nord, Schwerpunkt, taz, tageszeitung ","Dabei sind gleich mehrere Dinge auffällig. Wieso ist hier überhaupt eine Anrede notwendig? Selbst ein herkömmliches – und für manche Menschen schlicht falsches – „Herr“ oder „Frau“ käme in diesen Fragen eher gestelzt daher. Es würde auch der Name reichen. Außerdem: Wieso ist „Divers“ eine Auswahl in der Kategorie Anrede? Divers ist eine Bezeichnung für das Geschlecht eines Menschen, welches in diesem Antrag sinnigerweise nicht abgefragt wird. Vielmehr müsste mensch hier frei Schnauze wählen dürfen zwischen „Eure königliche Hoheit“, „Moin“ oder eben „Frau“ und „Herr“. Doch zurück zum Ernsthaften: Wie kann es passieren, dass beim Ändern eines solchen Antrags – vielleicht nach dem Urteil des Bundesverfassungsgerichts von 2017 – niemand am Ende darüber stolpert, dass die Formulierung spätestens hier absolut keinen Sinn mehr ergibt? Vor fünf Jahren urteilte das Gericht, dass es in Deutschland eine dritte Option bei der Angabe des Geschlechts geben muss. Seither gab es Urteile, nach denen diese Entscheidung auch Auswirkung auf den Umgang im Schriftverkehr mit Kun­d*in­nen hat. Darüber gestolpert ist Anfang der Woche ­Jessica Kordouni von den Grünen, die kürzlich ihr Mandat im Kieler Rat niedergelegt hat – aus beruflichen Gründen, berichteten die ­Kieler Nachrichten. Sie twitterte den Screenshot der Absurdität, schrieb dazu „Das sollte dringend korrigiert werden.“ Zieht sich das Kuriosum auch durch andere Online-Anträge des Landes? Es ist sogar noch schlimmer: Bei der Sichtung verschiedener Anträge finden sich immer mehr Varianten. Meist ist das Ausfüllen des Feldes „Anrede“ Pflicht. Selten gibt es dann die Möglichkeit, „keine Angabe“ anzuklicken. Oft hat mensch lediglich die Wahl zwischen „Herr“ und „Frau“. So ist es zum Beispiel beim Antrag für einen Parkausweis für An­woh­ne­r*in­nen in Flensburg – im Original als „Bewohnerparken“ betitelt. Auch wer seine Lehrzeit verlängern möchte, muss sich als Mann oder Frau identifizieren. Manchmal ist die Anrede optional – beispielsweise beim Erstellen eines Kontos für das große Serviceportal Schleswig-Holstein. Das benötigt beispielsweise, wer in den Kommunen Wohngeld online beantragen möchte, in denen das bereits geht. Dass es keine einheitliche Variante gibt, nicht einmal auf einem Portal, wirft kein gutes Licht auf die Gleichstellungsambitionen des Landes. Und dieser Einzelfall – ist es wirklich einer? – ist dazu noch peinlich.",NA
