"","X.2","X.1","X","url","date","title","author","description","keywords","body","error"
"47",47,43780,43780,"https://taz.de/Gendern-bei-den-Oeffentlich-Rechtlichen/!5832862/","2022-02-03T17:13:00+01:00","Gendern bei den Öffentlich-Rechtlichen: Meckern auf niedrigem Niveau","Steffen Grimberg","In Stellungnahmen zum neuen Medienstaatsvertrag schimpfen viele Bür­ge­r*in­nen übers Gendern. Beim Meckern sind die Deutschen gerne vorn dabei.","öffentlich-rechtliches Fernsehen, Öffentlich-Rechtlicher Rundfunk, Gendern, Kolumne Flimmern und Rauschen, Kolumnen, Gesellschaft, Serie, taz, tageszeitung ","Am Donnerstag bekommen die Me­di­en­re­fe­ren­t*in­nen der Bun­des­län­de­r jetzt einen ersten tieferen Einblick in die Ergebnisse präsentiert. Was bislang schon rausgesickert ist, stürzt ei­ne*n allerdings in milde Verzweiflung. Denn die meisten Eingaben der Bür­ge­r*in­nen beschäftigen sich höchst negativ mit dem Thema Gendern. Der Tenor ist eindeutig: Gendern ist Schrott, nervt und bitte weg damit! Dabei kommt Gendern im Entwurf für den neuen Medienstaatsvertrag überhaupt nicht vor. Die ARD hatte Mitte 2021 schon eine ähnliche Befragung gemacht und knapp vier Wochen zum Zukunfts-Dialog aufgerufen. Kann sich zwar kaum wer dran erinnern, weil es immer noch keine Ergebnisse gibt. Aber immerhin stehen bis diesen Mai die eingereichten Ideen und Beiträge noch auf der Website. Auch hier gab es kritische Stimmen zum Gendern. „Stern und Doppelpunkt sind wohl gut gemeint. Doch als schwuler Mann fühle ich mich durch die Gendersprache eher sexualisiert und markiert. Sie macht alles nur noch schlimmer“, heißt es da beispielsweise in einer Rückmeldung. „Groteske Sprachexperimente“ würden dafür sorgen, „dass gegenderte Inhalte oder die Probleme der LGBT-Gruppe von einer genervten Mehrheit nicht mehr ernst genommen werden“. Echt jetzt! Und deswegen geschlechtergerechte Sprache abwürgen? Kann die Debatte nicht einfach ein bisschen entspannter geführt werden? Wir üben hier doch alle noch! Das bedeutet Auswüchse, Absurditäten und seltsamerweise eine bizarre Angst, man(!) würde hier etwas verlieren. „Ist doch aber wichtig, dass alle mitgenommen werden und keiner draußen bleibt. Das Besondere ist, die Achtsamkeit zu haben, was und wie es gesagt wird“, sagt die Mitwohnende. Denn wie leicht Gendern sein kann und worauf es ankommt, zeigt zum Beispiel das Buch „Gender-leicht“ von Christine Olderdissen. Da heißt ein Kapitel „Respekt! Höflichkeit! Divers!“ und gilt auch fürs Meckern über die Öffentlich-Rechtlichen. Ausführliche Rezension folgt. ",NA
"48",48,44134,44134,"https://taz.de/Der-Hausbesuch/!5832341/","2022-02-20T10:01:00+01:00","Der Hausbesuch: Gottesdienst für Spätaufsteher","Lea Schulze","Die jungen Pastoren Max Bode und Chris Schlicht haben ihre erste Gemeinde in Bremerhaven: Sie gendern, predigen in Jeans und fahren Skateboard.","Der Hausbesuch, Bremerhaven, Bremische Evangelische Kirche, Religion, IG, Alltag, Gesellschaft, Feed, taz, tageszeitung ","Draußen: Triste Mehrfamilienhäuser in Plattenbauoptik dominieren das Straßenbild in Bremerhavens Ortsteil Grünhöfe. Dazwischen dann und wann ein Dönerladen, ein paar Discounter. Nirgendwo sonst in der Stadt sind die Mieten so günstig. Die Arbeitslosigkeit und die Kinderarmut hier sind hoch, viele Menschen haben einen Migrationshintergrund. Das Viertel hat einen schlechten Ruf. Zu Unrecht, sagen Max Bode und Chris Schlicht. Drinnen: An der Wand im Flur des Pfarrhauses hängen Skateboards. „Das sind unsere Dienstfahrzeuge“, sagt Schlicht. Die Möbel in ihrem Büro haben sich die beiden in der Gemeinde zusammengesucht, alles Zeug, das irgendwo rumstand. An dem großen Holztisch arbeiten sie meistens gemeinsam. Max Bodes Haare sind grün, das wechselt regelmäßig. Chris Schlicht hat ein großes Tattoo auf dem Arm, trägt ein umgedrehtes Baseball-Cap. Die beiden sind 33 und 30 Jahre alt und teilen sich eine Stelle. In der Emmaus-Gemeinde stellen sie das erste Teampfarramt der Landeskirche Hannover. Jeder von ihnen hat eine Woche im Monat frei. Schlicht wohnt im Pfarrhaus, Bode nur ein paar Meter weiter in einem der grauen Wohnblocks. Anders: Kennengelernt haben sie sich am Ende ihres Theologiestudiums in Göttingen. Gemeinsam rasselten sie durchs Examen, gemeinsam schafften sie es beim zweiten Anlauf. Das schweißte die Freunde noch enger zusammen. Für beide stand nach dem Vikariat fest: Kein Talar, kein Business as usual, sie wollen etwas verändern, am liebsten zu zweit. „Wer wird die neue Welt bau’n, wenn nicht du und ich“, zitiert Bode Rio Reiser­. Das Konzept hat es so noch nicht gegeben, aber die Evangelische Landeskirche gibt ihr Go. Die Berufsanfänger wünschen sich eine Gemeinde, in der es Probleme gibt, in der länger niemand mehr war. Auch das klappt. Empathie: Der Vater von Chris Schlicht ist Pastor, die Mutter Krankenschwester. Die Familie zieht oft um. „In der Schule war ich Außenseiter; zu Hause war mein Safe Space.“ Als Kind weint er viel. Das gehöre sich nicht für einen Jungen, hört er immer wieder. Er ärgert sich über seine Sensibilität, will ein anderer sein. Heute empfindet er seine Empathie als großes Geschenk. „Durch den Beruf meines Vaters war Gott natürlich irgendwie immer präsent in unserer Familie. Trotzdem hat er in meinem Leben lange keine Rolle gespielt.“ Bis Schlicht mit 18 an einem Rock-Gottesdienst teilnimmt. Man muss dem Gott nicht danke sagen, du kannst ihm auch vor die Füße kotzen, heißt es dort in der Predigt. „Das habe ich dann auch gemacht. Und es hat mein Leben verändert. Irgendwie habe ich da verstanden, dass ich genau richtig bin, so wie ich bin.“ Liebeskummer: Irgendwann sei es dann cool geworden, gefühlvoll zu sein. „Plötzlich standen sogar Mädchen auf mich.“ Doch auch eine unglückliche Liebe bleibt nicht aus. Während des Zivildienstes verliert Chris Schlicht sein Herz an eine Kollegin, unerwidert. „Oh Gott, habe ich damals gelitten, ich habe wirklich nichts ausgelassen, Gedichte schreiben, dramatische Musik, Rotwein.“ Als seine Angebetete Sonderpädagogik studiert, will er das auch, scheitert aber am Numerus clausus. „In der Kneipe hat mich ein Kumpel damals gefragt, warum ich eigentlich nicht Pastor werde.“ Schmerz: Als sich sein Studium dem Ende zuneigt, stirbt Chris Schlichts Mutter mit Anfang 50, aus heiterem Himmel. Ihr Tod wirft ihn aus der Bahn. „Wir hatten ein sehr enges Verhältnis, sie war mein Vorbild.“ Von Gott will er in den Monaten danach nichts hören. Zuhören: Bei Maximilian Bode lief es anders. Auch er wächst in einer gläubigen Familie auf, seine Eltern unterrichten beide Religion an Schulen. Anders als sein Kollege findet er seinen Zugang zu Gott schon früh. „In den existenziellen Krisen, die man als Kind so hat, zum Beispiel dem Tod der Oma, hat mir das wahnsinnig geholfen.“ Eigentlich will er Künstler werden. Doch als es von den Kunsthochschulen nur Absagen hagelt, begräbt er den Traum und kümmert sich um eine Alternative. Er sei der Typ, neben den sich im Bus oder auf Partys fremde Leute setzten, um ihm ihre Lebensgeschichte zu erzählen, sagt Bode: „Und ich finde das spannend.“ Warum nicht das zum Beruf machen? Während des Studiums hat er jedes Jahr einen anderen Plan für die Zukunft. Wirklich Pastor zu werden ist nie dabei. Glauben: „Gott hilft mir jeden Tag, kein zynisches Arschloch zu sein“, sagt Max Bode heute über sein Verhältnis zu Gott. Vieles am ganzen System sei scheiße, ohne Zweifel. Aber durch seinen Glauben habe er den Antrieb, es ändern zu wollen. „Vielleicht würde ich sonst als Zecke auf Brücken sitzen und pöbeln.“ Das habe er früher manchmal gemacht. Dem Punk fühlt er sich immer noch nah. „Aber klar, mit einem Beamtengehalt passt das natürlich nicht mehr so.“ Neustart: Eine Hand geschüttelt haben Bode und Schlicht in ihrer Gemeinde noch nie. Im Sommer 2020, mitten in der Pandemie, geht es für sie nach Bremerhaven. Ihre ersten Amtshandlungen: Der Gottesdienst am Sonntag wird von 10 auf 17 Uhr verschoben und die Kirchenglocke, die jeden Morgen um 8 Uhr schepperte, wird abgestellt. „Das kam gut an, viele Leute in Grünhöfe arbeiten im Schichtdienst, das hat die jeden Tag aus dem Schlaf gerissen.“ Auch die Orgel hat ausgesorgt. #Zuhausekirche: Willkommen zuhause!, damit wirbt die Emmaus-Gemeinde. An der Kirche hängt ein großes Banner mit dem Hashtag. In der Kirche stehen Sofas, es gibt eine Spielecke. Die beiden Pastoren predigen so, wie sie sind, nicht im Talar. Einerseits, weil sie sich nicht verstellen wollen, andererseits, um die Hemmschwelle, in die Kirche zu kommen, zu verringern. „Wir wollen den Leuten sagen: Wenn wir hier so sein können, wie wir sind, dann könnt ihr das auch“, sagt Chris Schlicht. Viele Menschen im Viertel seien gesellschaftlich isoliert und fühlten sich nicht akzeptiert – in der Emmaus-Gemeinde sollen sie sich zu Hause fühlen. Scheiße: In ihren Gottesdiensten thematisieren die jungen Pfarrer vor allem Alltagsprobleme. Oft fällt das Wort „Scheiße“. Der Fokus: Seelsorge. „Jeder hat die Sehnsucht, sich angenommen zu fühlen. Da ist es doch Mist, wenn sich Leute auf den Weg in die Kirche machen, nichts verstehen und wieder enttäuscht werden.“ Niemand sei schlechter oder besser, weil er Arzt ist oder Hartz IV bekommt, das sei ihre Botschaft. Ihr Konzept kommt an, die Besucherzahl steigt. Die aber, die sich nicht an das Neue gewöhnen können, wurden an andere Gemeinden vermittelt. Nachbar: Weil Max Bode in einem der grauen Wohnblocks von Grünhöfe wohnt, ist er am Geschehen in der Nachbarschaft ein bisschen näher dran als Chris Schlicht – obwohl es auch im Pfarrhaus oft genug klingelt. „Mich trifft man noch auf einer anderen Ebene. In erster Linie bin ich Nachbar, dann Pastor“, erklärt Bode. Die Gespräche über die Balkone hinweg will er nicht missen. „Für mich sind das nicht mehr viele identisch aussehende graue Häuser. Ich denke, in jedem dieser Häuser stecken spannende Geschichten. Einmal klingelte ein Junge aus dem Haus und fragte, warum es in der Bibel keine Dinos gibt. Warum er keine Angst vor Überfremdung habe, will ein anderer Nachbar von Bode wissen. „Das sind genau die Gespräche, auf die ich Bock habe und für die ich mir Zeit nehme.“ Social Media: Bode und Schlicht posten fast jeden Tag aus ihrem Leben, auch um zu zeigen, dass sie immer ansprechbar sind. Die #Zuhausekirche gibt es auch als App. Schlicht bekommt sogar ein Viertel seines Gehalts dafür, auf seinem eigenen Kanal @wynschkind Insta-Pastor zu sein. „Manchen Menschen fällt es leichter, im Chat über ihre Probleme zu sprechen statt von Angesicht zu Angesicht. Daran ist nichts cringe, jeder Mensch hat einen anderen Kanal, auf dem er sich öffnen kann.“ Alle Gottesdienste gibt es auch im Livestream, dort ist inzwischen mehr los als in der Kirche. Träume: Dass eines der größten Hobbys seines Lebens zu seinem Beruf geworden sei, könne er manchmal immer noch nicht fassen, sagt Maximilian Bode. Trotzdem, eigentlich hatten sie sich das alles anders vorgestellt. „Ich wollte ein Kneipenpastor sein, Grillen, große Sommerfeste, ein Techno-Gottesdienst, wir haben so viele Pläne. Da hat Corona uns bislang einen Strich durch die Rechnung gemacht. Aber die Zeit, um noch mehr Neues auszuprobieren, wird sicher noch kommen.“",NA
"49",49,44870,44870,"https://taz.de/Gendergerechte-Sprache/!5755038/","2021-03-19T15:10:00+01:00","Gendergerechte Sprache: Papa und das Sternchen","Peter Weissenburger","Moderatorin Petra Gerster gendert in den „heute“-Nachrichten. Und plötzlich sitzt man beim eigenen Vater und spricht über Feminismus.","Gendersternchen, Kolumne Unisex, Kolumnen, Gesellschaft, Serie, taz, tageszeitung ","Heute möchte ich übers „Gendern“ reden. Das ist recht ungewöhnlich, denn eigentlich will ich nie übers Gendern reden. Ich möchte gendern – darüber reden wollen andere. Sie sagen dann, das sei doch Unsinn: die Idee, dass Sprache die Wirklichkeit so forme, dass die „realen Probleme“ dadurch weggingen. Sie sagen, dass der Effekt von bewusst veränderten Wörtern so unschätzbar groß nicht sei, dass sich dafür die Mühe lohne. Und sie haben recht. Natürlich ist es nicht so, dass Gleichheit steigt und Sexismus sinkt mit jedem Gendersternchen, das wir in die Welt hinein kehlkopfknacken. Deshalb bin ich normalerweise absolut dafür, lieber über die „realen Probleme“ zu reden. Aber heute ist es anders. Heute will ich übers Gendern reden. Grund dafür ist mein Vater. Der kündigte neulich an, er wolle sich mit mir übers Gendern unterhalten („Gendern“ mit G wie „Günter“). Dass mein Vater darüber reden will, habe nicht etwa ich erreicht – mit all meinen Semestern Gender Studies, sondern Petra Gerster, indem sie einen Abend bei Maischberger gesessen hat. Petra Gerster kehlkopfknackt in den „heute“-Nachrichten und ist auch bereit, zu erläutern, warum. Und plötzlich sitze ich bei meinem Vater und er berichtet von Dingen, die er früher mal zu Frauen gesagt hat und die er jetzt so nicht mehr sagen wolle. Er erzählt, dass er sich früher manchmal einen Spaß daraus gemacht habe, Gruppen gemischten Geschlechts mit „Hallo Männer!“ anzusprechen, und dass er heute besser verstehe, warum das die anwesenden Frauen so verärgert habe. Und ich erzähle vom Handballverein, in dem die älteren Jungs uns Neue mit „Mädels“ anredeten, um uns unseren Platz zuzuweisen. Ich berichte von der Studie der Freien Universität mit sechshundert Grundschulkindern. Die ergab, dass die Kinder sich bestimmte Berufe eher zutrauten, wenn sie zuvor sowohl in der männlichen als auch in der weiblichen Form vorgelesen worden waren. Und mein Vater nickt verstehend. Gendert mein Vater also ab sofort? Wahrscheinlich nicht. Nicht mit G wie „Günter“ und ganz sicher nicht mit G wie „Gina“. Mein Vater ist über 80, zwischen uns passt fast ein ganzes Boomer-Leben. Es geht mir auch nicht darum, ob er gendert. Es geht mir darum, dass wir einen angenehmen Austausch über Feminismus hatten. Und zwar, weil Petra Gerster gendert. Gerechte Sprache macht nicht automatisch eine gerechte Welt, jedenfalls nicht nach dem Prinzip „Sprich nur ein gegendertes Wort, so wird meine Seele gesund“. Aber unsere Sprache ist uns eins der liebsten, teuersten Dinge. Der launische, verletzliche Teil unseres Selbst, mit dem wir in den Sturm der Menschengesellschaft reinragen. Veränderungen in der Sprache berühren uns, greifen uns an, bringen uns auf. Sie zwingen uns, uns zu verhalten zu den Dingen, über die da gesprochen wird. Wo also besser anfangen, über etwas zu sprechen, als bei der Sprache selbst?",NA
"50",50,44929,44929,"https://taz.de/Biologin-ueber-Gendertheorie/!5755490/","2021-03-14T18:48:00+01:00","Biologin über Gendertheorie: „Zivilisation ist androzentrisch“","Sophia Zessnik","Meike Stoverock untersucht in dem Buch „Female Choice“ das Paarungsverhalten von Tieren und Menschen. Und findet ein Muster gegen männliche Dominanz.","Sachbuch, Interview, Gender, Biologie, Sexualität, Fortpflanzung, Tierwelt, Patriarchat, Gesellschaft, Buch, Kultur, Projekt:taz.gazete:de, taz, tageszeitung ","taz: Frau Stoverock, Ihr Buch trägt den Titel „Female Choice“ – ein biologischer Begriff, der sich auf das Paarungssystem vieler Tierarten bezieht. Was hat das mit dem Menschen zu tun? Meike Stoverock: Es beschreibt ein System, bei dem sich Männchen um Möglichkeiten zur Fortpflanzung bewerben müssen. Um Sex zu bekommen, müssen sie Leistungen erbringen; kämpfen, Geschenke machen, hübsch aussehen. Die Weibchen entscheiden, mit wem sie sich fortpflanzen. Bis zur Sesshaftwerdung, als Menschen noch keine hochkultivierten Wesen waren, galt die female choice auch dort. Erst durch den Aufbau einer nach männlichen Bedürfnissen gestalteten Zivilisation wurde dieses Prinzip unterdrückt. Sie bezeichnen diese Unterdrückung als das Fundament, auf dem alle heutigen politischen Systeme und Kulturkreise stehen. Worauf stützt sich Ihre These? Natürlich ist es problematisch, Phänomene aus dem Tierreich eins zu eins auf den Menschen zu übertragen, deshalb bin ich zurückgegangen zu dieser Schwelle zwischen frühen Hominiden und Menschen, die komplexe Gedanken formulieren. Menschen waren einmal Instinktwesen. Ich versuche zu zeigen, dass diese Instinkte nicht aufgehört haben, sondern in diese entstehende sesshafte Zivilisation integriert wurden. Sexualität und Fortpflanzung sind der wichtigste Evolutionsmotor. Ich glaube, dass Menschen da in einer vorkulturellen Zeit keine Ausnahme waren. Da strebten Männer nach Sex, der nicht frei verfügbar war, weil Frauen ihn kontrollierten. Es ist nicht unproblematisch, sich auf evolutionsbiologische Unterschiede bei Menschen zu beziehen, Stichwort Eugenik. Sie plädieren für eine wertneutrale Neubesetzung. Es ist vernünftig, bei biologischer Argumentation genau hinzuschauen. Für mich spielt eine entscheidende Rolle, dass diese gesamten biologischen Erkenntnisse über die Jahrhunderte immer nur von Männern zu ihrem eigenen Nutzen interpretiert wurden. Sie haben ihr Wissen, ihre Erkenntnisse ausgenutzt und missbraucht, wodurch furchtbare Verbrechen möglich wurden. Ich glaube, man sollte Unterschiede zwischen Menschen – nicht nur Männern und Frauen, auch zwischen Alten und Jungen sowie verschiedenen Ethnien benennen können. Wichtig ist: Der biologische Sachverhalt eröffnet Möglichkeiten, die patriarchale Deutung begrenzt oder verhindert diese. Denn sie wertet und weist Menschen einen Platz zu, und das ist nicht zufällig fast immer einer unter dem weißen männlichen Individuum. Das formulieren Sie deutlich: „Unsere Zivilisation funktioniert nur für eine Sorte Mensch: den Mann.“ Ja, wir leben in einer androzentrischen Zivilisation. Das bedeutet, dass die Welt auf den Mann, seinen Körper, seine Eigenschaften und Prioritäten zugeschnitten ist. Ganz praktisch kann man das in der medizinischen Forschung sehen und in der Gestaltung von Sicherheitsmaßnahmen. All das ist zugeschnitten auf einen Körper, der eher männlichen Parametern entspricht. Das führt regelmäßig dazu, dass solche Maßnahmen für Menschen außerhalb dieser festgelegten Norm nicht passen. Um dem Androzentrismus etwas entgegenzusetzen, betrachten Sie die Biologie des Menschen und ihre Auswirkungen auf unsere Gesellschaft aus feministischer Sicht. Wie geht das? Für mich spielt die anhaltende Unterdrückung der Frau eine ganz wesentliche Rolle für die strukturellen Ungerechtigkeiten, die uns heute beschäftigen. Dabei ist die Unterdrückung der weiblichen Sexualität und der damit einhergehenden female choice für mich keine Nebenwirkung des Zivilisationsprozesses, sondern seine bedingende Grundvoraussetzung. Wenn wir zurück zur female choice gehen, würde also alles gut werden? Nicht, wenn wir nicht unsere gesellschaftlichen Narrative ändern. Denn ein Muster der female choice ist, dass sich 80 Prozent der Frauen für nur 20 Prozent der Männer entscheiden. Das heißt, eine Mehrzahl an Männern bekommt keinen Sex. Das heißt nicht, dass diese Männer Versager sind. Wenn wir uns die Tierwelt anschauen, dann ist das Männchen, das keine Partnerin findet, der Normalfall. Das Premiummännchen, das sich fortpflanzt, ist die Ausnahme. Daran ist nichts Ungewöhnliches. Sie schreiben aber, dass männliche Lebewesen, die keinen Zugang zu Sex haben, aggressiv werden. Genau. Physisch gesehen, wird Testosteron im Körper durch Sex abgebaut, – auch bei Frauen. Testosteron ist ein Leistungshormon, das Muskelwachstum fördert. Allerdings macht es in hohen Mengen aggressiv. Da wird es problematisch: Wenn Testosteron im Körper ansteigt, es aber keine Möglichkeit gibt, es abzubauen, entsteht sexueller Frust. Dass männliche Individuen diesen an Schwächeren auslassen, zieht sich wie ein roter Faden durch die Tier- und Menschenwelt. Für Männer, die unfreiwillig enthaltsam leben, hat sich der Begriff „Incels“ etabliert. Sie fallen besonders durch Hass und Hetze im Internet auf. Wie gefährlich sind sie für unsere Gesellschaft? Ich glaube, diese Aggression gehört zum Mannsein dazu. Damit soll aber keineswegs gewaltsames Verhalten gerechtfertigt werden. Aber um diese Gewalt in den Griff zu bekommen, muss man sie als etwas Integrales begreifen – als Teil der menschlichen Natur. Die unfreiwillige sexuelle Enthaltsamkeit führt zu Einsamkeit, zu dem Gefühl, ein Versager zu sein und am Mindestanspruch der männlich geprägten Zivilisation zu scheitern. Es gibt aber Männer, die nach dem Prinzip der female choice nicht erwählt werden und sie müssen wir als Gesellschaft auffangen. Denn selbst wenn sie nicht gewaltsam agieren, wählen Incels häufig rechtskonservative Parteien, die an der patriarchalen Ordnung festhalten und unserer Gesellschaft damit schaden. Wie könnte man dem entgegenwirken? Ihnen Hilfe anbieten, zum Beispiel, indem man ihnen sexuelle Erleichterung durch professionelle Sexbegleitung verschafft, wie sie für Menschen mit Beeinträchtigung oder alte Menschen bereits möglich ist und von Krankenkassen mitfinanziert wird. Sie konzentrieren sich auf die binäre Geschlechterordnung. Ist das nicht unzeitgemäß? Ich denke auch, dass dieser rein binäre Begriff nicht zeitgemäß ist, aber da es in meinem Buch vor allem um fortpflanzungsbiologische Aspekte geht, habe ich mich auf Frau und Mann konzentriert. Bei der Fortpflanzung kommt es schließlich auf zwei unterschiedliche Geschlechter an, die bestimmte genetische Merkmale aufweisen. Dass sowohl kulturell als auch biologisch die Bandbreite der Geschlechter viel weiter ist, steht für mich außer Frage. Sie schreiben, dass Menschen, bei denen Chromosom- und Hormonpegel nicht dem gleichen Geschlecht entsprechen, non-binär seien. Beweist das nicht aus biologischer Sicht, dass der Glaube an eine binäre Geschlechterordnung faktisch falsch ist? Der ist auf jeden Fall falsch. Wenn die Chromosomen auf ein Geschlecht hindeuten, die Hormone aber auf ein anderes – was will man da als biologisches Geschlecht benennen? Bei beidem handelt es sich um physische Faktoren, die deutlich messbar und nachweisbar sind. Das nicht-binäre Geschlecht ist weitaus mehr als nur eine kulturelle Spinnerei, als die es ja oft von Kritikern bezeichnet wird. Wenn wir solche biologischen Erkenntnisse mehr in den Diskurs mit reinbringen, dann kann das nicht-binären und trans Personen helfen, Akzeptanz für ihre Identität zu bekommen. Erhoffen Sie sich das von Ihrem Buch? Mein naiver Wunsch ist es, eine Handreichung zu schaffen. Momentan scheint der Geschlechterdiskurs verhärtet. Man redet kaum miteinander. Jeder beansprucht die absolute Wahrheit für sich und alles, was davon abweicht, wird zum Feindbild erklärt. Ich möchte zeigen, wie stark Biologie und Kultur Hand in Hand gehen. Können Sie das ausführen? Ich denke, dass Kultur sowohl die Macht hat, biologische Muster zu verstärken, Stichwort toxische Männlichkeit, als auch biologische Muster zu behindern, wie etwa bei der female choice und der Unterdrückung weiblicher Sexualinstinkte. Ich möchte einen Beitrag leisten, dass Menschen, egal welchen Geschlechts, ihre Existenz besser verstehen und es schaffen, einander mehr zu respektieren – als Menschen mit unterschiedlichen Bedürfnissen.",NA
