"","X.2","X.1","X","url","date","title","author","description","keywords","body","error"
"12",12,14522,14522,"https://taz.de/Genderverbot-beschlossen/!5827892/","2022-01-23T16:15:00+01:00","Genderverbot beschlossen: Bremerhavens eigene Sprache","Selma Hornbacher-Schönleber","Das Stadtparlament in Bremerhaven entscheidet nur noch über Belange von „Bürgerinnen und Bürgern“. Die von „Bürger:innen“ sind „rechtschreibwidrig“.","Gender, Bremerhaven, Nord, taz, tageszeitung ","BREMEN taz | In Bremerhaven hat die Stadtverordnetenversammlung beschlossen, künftig nicht mehr über Vorlagen und Dokumente zu verhandeln, in denen mit Sonderzeichen gegendert wird. Im Dezember hatte die regierende Koalition aus SPD, CDU und FDP bereits der Verwaltung verboten, mit Sonderzeichen zu gendern. Sternchen, Doppelpunkt und dergleichen gelten damit als „rechtschreibwidrig“. Dies steht im Widerspruch zur Handreichung über gendersensible Sprache des Landes Bremen. Mit dem Benutzen von gendersensibler Sprache versuchen die Ver­fas­se­r:in­nen von Texten, alle Personen, unabhängig von ihrem Geschlecht, einzubeziehen. Doppelformulierungen in männlicher und weiblicher Form, wie „Schülerinnen oder Schüler“, leisten das nicht: Nichtbinäre, agender oder intergeschlechtliche Personen finden sich in solchen Formulierungen nicht wieder. Aber dass geschlechtliche Identität über die binäre Frau/Mann-Klassifizierung hinausgeht, steht seit einem Beschluss des Bundesverfassungsgerichts von 2017 auch juristisch fest – und sie wird als Persönlichkeitsrecht geschützt. Durch neutrale Formulierungen wie „Pflegekraft“, werden Menschen unabhängig ihres Geschlechts einbezogen. Wo es keinen neutralen Begriff gibt, helfen Genderstern, ein Unterstrich oder Doppelpunkt. Bremerhavens Regierungskoalition lehnt das nun geschlossen ab. Die drei männerdominierten bis ausschließlich männlich besetzten Fraktionen führen dabei die gleichen altbekannten Argumente auf wie viele andere Kri­ti­ke­r:in­nen gendergerechter Sprache: Das Festhalten an der Rechtschreibung, die gute Lesbarkeit, das stille Mitgemeint sein derer, die nicht explizit genannt werden. Der Vorsitzende der Bremerhavener FDP-Fraktion, Hauke Hilz, argumentiert gegenüber der taz mit Barrierefreiheit. „Das ist für uns der Hauptgrund“, sagt er. Für viele Menschen mit Behinderungen wie etwa Autismus, die auf eine klare Sprache angewiesen seien, können solche Schreibweisen ein schwieriges Hindernis darstellen. Außerdem habe Bremerhaven gendersensible Sprache gar nicht verboten, sondern vielmehr in der Form geregelt, dass „beide Geschlechter genannt werden oder ein genderneutrales Nomen“, sagt Hilz. Bettina Wilhelm, Landesfrauenbeauftragte für Bremen, empfindet die Regelung als Rückschritt. Zu den Grundrechten gehöre auch, Menschen korrekt anzusprechen. Dies verletze Bremerhavens Amtssprache, da durch das Verbot von Sonderzeichen effektiv nichtbinäre Menschen ausgeschlossen würden. Auch fachlich sei das Verbot völlig überholt, es entspreche schon längst nicht mehr den Standards einer Amtssprache. Allerdings treffe die Kritik einen Punkt: „Keines der Sonderzeichen ist komplett barrierefrei“, sagt Wilhelm. Verschiedene Sonderzeichen seien je nach Art der Beeinträchtigung mehr oder weniger verständlich und funktionierten mit unterschiedlichen Assistenzprogrammen besser oder schlechter. Nach derzeitigem Stand schließe damit die Schriftsprache immer jemanden aus, so Wilhelm. Der Verzicht auf Sonderzeichen sei aber für nicht-binäre Menschen „ein grundsätzlicher Ausschluss, kein technischer“. Der Landesbehindertenbeauftragte Arne Frankenstein unterstützt Bremens Handreichung zu gendersensibler Sprache. Indem Kontext und Zielgruppe bei der Verwendung von Sonderzeichen mitgedacht werden, könne Sprache barriereärmer gestaltet werden, sagt er. Außerdem weist er auf intersektionale Mehrfachmarginalisierung hin: „Auch unter Leichte-Sprache-Nutzer:innen können sich nichtbinäre Menschen befinden“. Wilhelm hat ihre Kritik am Gender-Verbot in Absprache mit Frankenstein verfasst und positioniert sich eindeutig: „In Ermangelung einer idealen Lösung nichts zu tun, sei sicherlich keine Option.“ Darüber hinaus ein Verbot auszusprechen, sei „rückwärtsgewandt und fatal“. Auch in Bremerhavens Opposition und im Land Bremen stößt das Verbot auf Widerspruch. Bremerhavens Grüne fordern, den Beschluss des Magistrats umgehend zu korrigieren. Die Abgeordnete Kai Wargalla kritisiert auf Twitter den „politischen Backlash des queerfeindlichen Patriarchats“.",NA
"13",13,14578,14578,"https://taz.de/Gendergerechte-Sprache/!5825326/","2022-01-14T13:33:00+01:00","Gendergerechte Sprache: Adieu, Fräulein!","Lenard Brar Manthey Rojas","Vor fünfzig Jahren wurde die Anrede „Fräulein“ aus dem Sprachgebrauch verbannt. Ein Grundstein für gendergerechte Sprache?","Gendergerechte Sprache, Frauenbewegung, Sprache, Feminismus, Alltag, Gesellschaft, Schwerpunkt, taz, tageszeitung ","Wer sich mit deutschsprachiger Literaturgeschichte befasst, kommt an der Anrede „Fräulein“ eigentlich nicht vorbei. Von Hoffmanns „Das Fräulein von Scuderi“ (1819) bis zu Schnitzlers „Fräulein Else“ (1924) taucht der Begriff immer wieder auf. Im aktiven Sprachgebrauch wird die Anrede, mit der man das Wort an unverheiratete Frauen richtete, hingegen kaum noch verwendet. Lange Zeit jedoch erwarb eine Frau erst durch die Ehe das Recht, auch als „Frau“ angesprochen zu werden. Die Anrede einer Frau war somit abhängig von ihrer Beziehung zu einer männlichen Person. Ein Mann war allerdings immer ein Mann, Ehe hin oder her. An diesem Sonntag ist es auf den Tag genau 50 Jahre her, dass die Anrede „Fräulein“ aus der Behördensprache der Bundesrepublik verschwunden ist. Die österreichische Schriftstellerin und Feministin Franziska von Kapff-Essenther hatte schon im Jahre 1871 die Anrede „Fräulein“ kritisch hinterfragt. Schließlich, so die Begründung in ihrer Schrift „Der Titel,Frau'“ (1871), würde auch niemand einen Mann mit „Herrlein“ ansprechen. Eine sprachliche Angleichung der Geschlechter-Anrede durch den Begriff „Herrlein“ hat sich bis heute nicht ergeben. Dafür verschwand die Anrede „Fräulein“ zunehmend aus dem deutschsprachigen Raum. Ein wichtiges Datum für diese Entwicklung stellt der 16. Januar 1972 dar. An diesem Tag wurde durch einen Erlass des Bundesministerium des Inneren, das damals von Hans-Dietrich Genscher (FDP) geleitet wurde, der Begriff aus der behördlichen Sprache der Bundesrepublik verbannt. Zwar mussten Behörden bereits seit 1955 eine unverheiratete Frau mit „Frau“ anreden, sofern diese das wünschte, aber es war dafür eben noch eine aktive Handlung notwendig. Erst ab 1972 wurde der Begriff „Fräulein“ gänzlich aus der Sprache der Ämter gestrichen. Die Formulierung, die durch die Verkleinerungsfrom „-lein“ immer auch ein wenig so wirkte, als würde man sich gerade mit einem kleinen Mädchen unterhalten und nicht mit einer erwachsenen Person, wurde damals als nicht mehr zeitgemäß empfunden. Die Begründung lässt sich auch heute noch in dem Erlass nachlesen: „Es ist an der Zeit, im behördlichen Sprachgebrauch der Gleichstellung von Mann und Frau und dem zeitgemäßen Selbstverständnis der Frau von ihrer Stellung in der Gesellschaft Rechnung zu tragen. Somit ist es nicht länger angebracht, bei der Anrede weiblicher Erwachsener im behördlichen Sprachgebrauch anders zu verfahren, als es bei männlichen Erwachsenen seit jeher üblich ist. […] Im behördlichen Sprachgebrauch ist daher für jede weibliche Erwachsene die Anrede ‚Frau‘ zu verwenden.“ Wenn von Gleichstellung im Sprachgebrauch und dem zeitgemäßen Selbstverständnis der Frau die Rede ist, drängen sich Überschneidungen mit aktuellen Debatten geradezu auf. In gewisser Weise war dieser Erlass von 1972 ein Schritt hin zu dem, was wir heute gendergerechte Sprache nennen. Von diesem Tag an war es für die Anrede in Behörden gleichgültig, ob eine Frau verheiratet war oder nicht. Dabei hat man doch derzeit in manchen Diskussionen den Eindruck, als wäre Sprache in Ämtern noch niemals seit Gründung der Bundesrepublik verändert worden. All jene, die beispielsweise in Gender-Diskussionen mit dem Argument „das hat es noch nie gegeben“ jegliche Veränderung der Sprachform als ungeheuerliche Erscheinung bezeichnen, werden zugeben müssen, dass nicht erst mit dem Gendersternchen unsere Ausdrucksweisen einem Wandel unterliegen. Man denke in diesem Falle also einfach an das Wort „Fräulein“, das eines Tages aus den Behörden verschwand. Anfang Dezember stellte der Kollege Deniz Anan in der taz die Frage, inwieweit die Ampelkoaltion eine Neuauflage der sozial-liberalen Koalition (SPD/FDP) aus dem Jahre 1969 werden wird. Dies wird sich auch am Umgang der Regierung mit einer sprachlichen Gleichberechtigung zeigen.",NA
"14",14,14799,14799,"https://taz.de/Bremerhavener-Sprach-Orthodoxie/!5827893/","2022-01-24T11:12:00+01:00","Bremerhavener Sprach-Orthodoxie: Mehr als ein Kulturkämpfchen","Alexander Diehl","Mit ihrem Nein zum Gendern ignorieren SPD, CDU und FDP in Bremerhaven höchste Rechtsprechung.","Bremerhaven, Bundesverfassungsgericht, Geschlechter, Bremen, Nord, taz, tageszeitung ","Ja – auf den ersten Blick: die geltenden Rechtschreibregeln, der fehlende Mehrheitswille zum Gendern und, durchaus nicht zuletzt, die Barrierefreiheit. Denn wer Sternchen und Doppelpunkte in die Wörter packt, bringt damit ja ausgerechnet die technischen Hilfsmittel ins Schlingern, die ihrerseits Schieflagen begradigen sollen, nämlich die Teilhabe von Menschen mit Behinderung. Aber richtig zu Ende gedacht haben sie ihren Widerstand eben doch nicht, die drei Koalitionärinnen – Fraktionen sind den geltenden Regeln nach ja immer noch weiblichen grammatikalischen Geschlechts; Abgeordneten-Männchen sind aber mitgemeint, selbstverständlich und voller Respekt. So ist Bremens Landesbehindertenbeauftragter ausdrücklich fürs Gendern; dass Screenreader die ach so sperrigen Sonderzeichen mit vorlesen, dürfte schlicht ein Übergangsproblem sein. Und würde Demokratie darin gipfeln, einen –ja auch nur in unterschiedlich seriösen Umfragen ermittelten – Mehrheitswillen durchzusetzen: Wie oft käme irgendeine Minderheit zu ihrem Recht? Eben so eines hat 2017 aber das Bundesverfassungsgericht formuliert, als es neben Mann und Frau eine dritte Geschlechtskategorie nicht nur erlaubte, sondern verlangte. Und das macht aus der Gender-Orthodoxie mehr als nur ein Kulturkämpfchen, mehr auch als schlichte Arbeitsverweigerung – denn was passiert, wenn künftig eine zu erledigende Sache solche bösen Zeichen enthält: Landet sie im Parlamentspapierkorb? Hier ignorieren sie in Bremerhaven ohne Not die Rechtsprechung.",NA
"15",15,15192,15192,"https://taz.de/Gendersternchen-in-Bremerhaven/!5830072/","2022-01-24T18:19:00+01:00","Gendersternchen in Bremerhaven: Krampfhaftes Festhalten","Eiken Bruhn","Die Fraktionsvorsitzenden von FDP, CDU und SPD in Bremerhaven rudern beim Genderbeschluss zurück. Die Erklärung offenbart ihre ewiggestrige Ideologie.","Gendersternchen, Gendern, Sprache, Gender und Sexualitäten, Bremen, Nord, Schwerpunkt, taz, tageszeitung ","Am Freitag hatten FDP, CDU und SPD ihren Beschluss verteidigt, der Bremerhavener Verwaltung Gendersternchen und Co. zu verbieten. Nach Kritik von allen Seiten ruderten sie am Montag zurück. Doch die Presseerklärung, mit der die drei Fraktionsvorsitzenden dies begründen, zeigt, dass es ihnen nicht um Barrierefreiheit geht, wie sie behauptet hatten. Es ist ihnen schlicht zu viel Gendergaga, wie schon anderen alten Männern vor ihnen. „Wir haben uns in der Vergangenheit immer wieder darüber geärgert, dass es zwar viele Diskussionen und politische – teilweise ideologisch geprägte – Haltungen zu gendersensibler Sprache gibt“, entlarven sie sich selbst. Sie. Haben. Sich. Geärgert. Nicht darüber, dass Männer nach wie vor privilegiert sind und Sprache dies spiegelt. Nicht darüber, dass ihnen keine perfekte Lösung einfällt. Sondern über andere, die ihnen diese noch nicht präsentiert haben. Und dabei ideologisch argumentieren! Das machen ja immer die anderen. Hier: Feminist:innen, die für eine gerechte Sprache kämpfen. Und nicht etwa Sexisten, die sich ans generische Maskulinum klammern, obwohl ihnen Grammatik ansonsten egal ist. Genüsslich listet die Erklärung die Vielfalt auf, mit der Sprache ausdrückt, dass es nicht nur handelnde Männer gibt, sondern auch Frauen sowie Menschen, die sich keinem Geschlecht zuordnen lassen: Genderstern, Doppelpunkt, Unterstrich, Querstrich, … Der Verdacht der Herren Raschen, Hilz und Allers und vermutlich der Mehrheit ihrer Fraktionskolleg:innen: „Da wird ein teilweise krampfhafter Versuch unternommen, die vorhandene geschlechtliche Vielfalt abzubilden.“ Die Verwendung des Begriffs „krampfhaft“ spricht Bände. Vielen gilt er als Synonym von „feministisch“. Hier meint er alle, die im Sinne der Gleichberechtigung kreativ mit Sprache umgehen. Sie sollen sich also mal locker machen, es nicht übertreiben, die Kirche im Dorf lassen? Nein. Gendersternchen und Co. sind eine Zumutung, sorgen für Streit und auch für Probleme. Das ist gut, weil so für alle sichtbar wird, mit welchen Zumutungen sehr viele Menschen leben müssen.",NA
"16",16,15320,15320,"https://taz.de/Filmfestival-fuer-jungen-Film/!5827489/","2022-01-27T17:16:00+01:00","Filmfestival für jungen Film: Wieder der Zeit voraus","Thomas Abeltshauser","Beim 43. Filmfestival Max Ophüls Preis ging es um Familien und Gendernormen. Preise ergatterten einige Filme mit queeren Thematiken.","Filmfestival, Max-Ophüls-Preis, Queer, Queer cinema, Film, Kultur, taz, tageszeitung ","Mit neun verkündet die kleine Uli, dass sie Papst werden will. Pirat sein wäre auch toll. Alles, nur keine Prinzessin. Uli ist ein Wildfang, passt in keine Schublade. Mit ihrer Weigerung, sich gängigen Geschlechterrollen anzupassen, wird sie selbst in der eigenen Familie zur Außenseiterin. In dem kleinen oberbayerischen Ort herrschen noch Tradition und die katholische Kirche, über vieles wird nicht gesprochen. Erst am Sterbebett ihres Vaters, viele Jahre später, erfährt Uli von dessen Doppelleben als Crossdresser. In „Anima – Die Kleider meines Vaters“ arbeitet Uli Decker, die inzwischen als Filmemacherin in Berlin lebt, die Geschichte ihrer Familie und deren Geheimnisse auf und damit ihr eigenes Aufwachsen als nicht genderkonformer Mensch. Ihre auch stilistisch eigenwillige Auseinandersetzung war einer der beeindruckenden Beiträge des 43. Filmfestivals Max Ophüls Preis, das am Mittwochabend mit der Preisverleihung in Saarbrücken zu Ende gegangen ist, wo „Anima“ als bester Dokumentarfilm ausgezeichnet wurde. Benannt nach dem in der Stadt geborenen Regisseur von „Lola Montez“ widmet sich das Festival jährlich dem Nachwuchs der deutschsprachigen Länder, die Filme selbst müssen nicht unbedingt deutschsprachig sein oder in einem dieser Länder spielen. Das zeigt sich auch in dem Spielfilm, der wie „Anima“ zu einer ganzen Reihe herausragender Filme mit queerer Thematik zählt und am Ende mit einigen der wichtigsten Preise ausgezeichnet wurde, darunter als bester Film und für das Drehbuch. Der in China geborene C. B. Yi studierte in Wien bei Michael Haneke Filmregie und erzählt nun in seinem Debütfilm „Moneyboys“ von einem jungen Mann, der seinen Lebensunterhalt als Rentboy verdient und damit auch seine Familie finanziell unterstützt, die zwar das Geld bereitwillig annimmt, von seiner Homosexualität aber nichts wissen will. Yis Spielfilm ist ein stilsicher inszeniertes Drama mit vielschichtigen Figuren, das zugleich einen faszinierenden Blick in die aufstrebende junge urbane Mittelschicht Chinas zwischen Tradition und Turbokapitalismus eröffnet. Ebenfalls aus Österreich stammt „Para:dies“ von Elena Wolff, der im Mockumentary-Stil von einem jungen Paar erzählt, Jasmin und Lee, die in Lees Elternhaus in Salzburg ziehen und dabei von der jungen Dokumentarfilmerin porträtiert werden. Ein überzeugend gespieltes Drama über queeres Leben in der Provinz und eine zunehmend toxische Beziehung, das lange fesselt, aber gerade dann unglaubwürdig wird, wenn die Grenze zwischen Beobachterin und Porträtierten verschwimmt. In Wien ist Fatih Gürsoys mittellanger Spielfilm „Neverinland“ angesiedelt, in dem Geflüchtete in ihrer Unterkunft auf ihren Asylbescheid warten und sich für eine Kostümparty ihren Wünschen entsprechend verkleiden, als König oder Supermann. Ein Abend, an dem zumindest einer von ihnen beginnt, seine wahre Identität zu leben. Wie bei „Anima“ und „Moneyboys“ geht es auch in Alina Yklymovas Kurzfilm „Störenfrieda“ um den Konflikt junger queerer Menschen mit der Elterngeneration. Ava und Sascha betreiben die gleichnamige FLINT*-Kneipe in Bochum als Schutzraum für die Community, das Paar lebt dort auch. Bis unvermittelt Avas Vater Gunter auftaucht, ein ehemaliger Bergarbeiter, der vorübergehend eine Unterkunft braucht und mit seiner unbeholfen-kumpelhaften Art für Irritationen sorgt. Am Ende scheint zumindest die Möglichkeit auf, miteinander ins Gespräch zu kommen. Nach einer rein virtuellen Covid-Ausgabe im vergangenen Jahr fand das Filmfestival Max Ophüls Preis diesmal hybrid statt, dezentral vor Ort auf mehrere Kinos verteilt sowie mit einem begrenzten Angebot online. Das junge Team um Festivalleiterin Svenja Böttger und den künstlerischen Leiter Oliver Baumgarten reagierte sehr umtriebig auf die sich ständig ändernde Situation, täglich wurden zahlreiche Publikumsgespräche online für Zu­schaue­r:in­nen gestreamt, die nicht vor Ort sein konnten. Auch die Preisverleihung am Mittwochabend wurde live auf der Festivalwebsite und Youtube übertragen. Die Jurys zeichneten dabei zum Großteil Filme mit queeren Thematiken aus und würdigten damit eine ebenso herausragende wie diverse Filmauswahl, die sich zum Großteil noch bis 30. Januar auf www.ffmop.de streamen lässt. Auf eine Art schließt sich damit ein Kreis zu den Anfängen des Festivals. Bereits 1981, im zweiten Jahrgang, wurde mit Frank Ripplohs autobiografischem „Taxi zum Klo“ über einen offen schwulen Lehrer in West-Berlin ein Spielfilm ausgezeichnet, der in seiner Radikalität seiner Zeit weit voraus war. Unter umgekehrten Vorzeichen tanzte in diesem Jahr bei den großen Gewinnern der Schweizer Spielfilm „Soul of a Beast“ des 1981 in Zürich geborenen Lorenz Merz aus der Reihe. Seine Dreiecksgeschichte ist ein wilder Genreritt durch den Großstadt­dschungel mit ausgebüxten Zootieren und im besten Sinne nonkonform. Dafür gab es am Ende den Preis für die beste Regie, den besten Nachwuchsdarsteller sowie den Kritikerpreis.",NA
"17",17,16405,16405,"https://taz.de/Der-Literaturhauschef-und-das-Gender-/!5763030/","2021-04-17T07:00:00+01:00","Der Literaturhauschef und das Gender-*: Fester Glaube","Alexander Diehl","Save our German: Eine ganze Seite überließ die „F.A.Z.“ dafür jetzt Hamburgs Literaturhauschef Rainer Moritz.","Gender, Deutsche Sprache, Gendergerechte Sprache, Hamburg, Frankfurter Allgemeine Zeitung, Hamburg, Nord, taz, tageszeitung ","Ganz so einfach ist die Sache nicht. Denn wenn Verlass ist auf etwas, dann darauf, dass Menschen, die der Veränderung eher nicht so zugewandt sind, fest daran glauben, dass sie sich natürlich entwickele, die Sprache. Auch das im Unterschied zu etwas, nämlich diesem menschengemachten Genderunfug, also dem dreisten Wunsch aller Nichtmänner, auch abgebildet zu werden in den Worten, statt bloß „mitgemeint“ in der angeblich neutralen männlichen Form. „Veränderungen wie diese rufen immer wieder scharfe Kritik hervor. Denn in Sprach­angelegenheiten regiert der feste Glauben an ein unumstößliches Regelwerk, das keine Aufweichung dulde. Konservatismus findet hier sein ureigenes Revier.“ Was klingt, als käme es aus einer Kampfschrift der nicht ganz jungen feministischen Sprachwissenschaft, stand am Montag in der – solcher Grillen maximal unverdächtigen – Frankfurter Allgemeinen Zeitung. Eine ganze Seite hatte man Rainer Moritz überlassen, Leiter des Hamburger Literaturhauses, für seine Überlegungen zur sprachlichen Gleichberechtigung. Nicht im bestens beleumundeten Feuilleton allerdings sinnierte der studierte Germanist da aber übers Gendersternchen, sondern im Politik-Ressort. Und wer immer den Gastbeitrag betreut hatte: Ihn oder – weniger wahrscheinlich – sie trieb Politisches um. Anmoderiert ist der Text, als müsste unser schönes freies Deutsch verteidigt werden gegen die Genderdiktatur: Vom „Wunsch, Sprache zu lenken und Kultur zu ‚säubern‘“ ist da prominent die Rede. Auch wenn er am Ende bei längst zum Gemeinplatz Geronnenen ankommt, von der leicht angegrabbelten Rede über die „linksidentitären Kreise“ bis zur echte Meis­ter­den­ke­r*in­nen­schaft ausweisenden „Unfähigkeit, Ambivalenz auszuhalten (Svenja Flaßpöhler)“: Moritz' Gedankengang ist an Nuancen reicher, als die F.A.Z. es ihren Lesenden offenbar glaubte zumuten zu können – die Verkaufe ist wohliger Kulturkampf-Grusel für die Frühstückstische (nicht nur) im saturierten Taunus. Schreckliches Unrecht freilich ist dem Mann damit auch nicht angetan worden: Immer wieder hat Moritz in der Vergangenheit angeschrieben und -diskutiert gegen ideologisches Überregulieren der Sprache, geriet aber auch gern mal gehörig ins Schwimmen dabei – die „unsichtbare Hand“, die er auch jetzt wieder bei offenbar weniger problematischen Formen des Sprachwandels am Werk sah: Sie ist ja eine Metapher; mithin etwas, mit dem Moritz sich auskennt. Das absichtsvolle, das Lenken, das Ringen um Repräsentation und Deutungshoheit: All das weiß er, Pardon, natürlich nur bei anderen zu erkennen, kaum mal bei sich selbst. Aber Projektion, wie sie da jetzt wieder am Werk gewesen sein wird, beim Hamburger Autor und dem Frankfurter Redakteur, die ist ja auch gar nicht Teil der Germanistik.",NA
"18",18,17668,17668,"https://taz.de/Die-Wahrheit/!5789864/","2021-08-19T08:31:00+01:00","Die Wahrheit: Schicksalslink","Moritz Hürtgen","Donnerstag ist Gedichtetag auf der Wahrheit: Heute darf sich die verehrte Leserschaft an einem Poem über eine gegenderte Liebe erfreuen.","Gedicht, Gendern, Liebe, Die Wahrheit, Wahrheit, taz, tageszeitung ","Da war nur ein Artikellink:  „Der Terror heißt heut Gendern.“ Und schon ging alles superflink, Es war nicht mehr zu ändern.  Du schriebst in Wut den Kommentar: „Ihr Boomer sollt verrecken!“ Ich fand das alles wunderbar und wollte etwas necken.  Drum kam von mir gleich die Reply: „Man sagt jetzt Boomer*innen! 😂“ Du hattest fünfzehn Likes, ich drei – Man kann nicht nur gewinnen.  Den nächsten Schritt hast du gemacht, Du doxxtest meine Nummer, Und riefst mich an tief in der Nacht, Doch brachtest keinen Kummer.  Man spricht ja kaum mehr analog, Wir teilten Ängste, Sorgen. Es war so schön, die Zeit verflog Bis in den frühen Morgen.  Im Flur hängt der Artikellink, Wir ließen ihn uns rahmen. Der Screenshot zeigt den Schicksalswink, Durch den wir zu uns kamen.  Das Glück, es wächst von Jahr zu Jahr – Ach! Wenn es nur so bliebe!  Am Anfang stand dein Kommentar Beim Honeypot der Liebe.",NA
